question,question_tag,property,answer,answer_tag
问不能胜任工作解除劳动合同有赔偿金吗,问题,专业回答,不能胜任工作解除劳动合同，用人单位若没有前三十日以书面形式通知劳动者本人，需要支付补偿金。《劳动合同法》第四十条规定，有下列情形之一的，用人单位提前三十日以书面形式通知劳动者本人或者额外支付劳动者一个月工资后，可以解除劳动合同：（一）劳动者患病或者非因工负伤，在规定的医疗期满后不能从事原工作，也不能从事由用人单位另行安排的工作的；（二）劳动者不能胜任工作，经过培训或者调整工作岗位，仍不能胜任工作的；（三）劳动合同订立时所依据的客观情况发生重大变化，致使劳动合同无法履行，经用人单位与劳动者协商，未能就变更劳动合同内容达成协议的。-法律依据：《劳动合同法》第四十条有下列情形之一的，用人单位提前三十日以书面形式通知劳动者本人或者额外支付劳动者一个月工资后，可以解除劳动合同：（一）劳动者患病或者非因工负伤，在规定的医疗期满后不能从事原工作，也不能从事由用人单位另行安排的工作的；（二）劳动者不能胜任工作，经过培训或者调整工作岗位，仍不能胜任工作的；（三）劳动合同订立时所依据的客观情况发生重大变化，致使劳动合同无法履行，经用人单位与劳动者协商，未能就变更劳动合同内容达成协议的。,回答
问解除劳动合同没有在劳动局备案怎么办,问题,专业回答,解除劳动合同没有在劳动局备案，可以要求用人单位办理或要求出具解除劳动合同的证明。用人单位与职工终止或解除劳动合同的，应在终止或解除劳动合同后7日内进行劳动用工备案。《劳动合同法》第五十条规定，用人单位应当在解除或者终止劳动合同时出具解除或者终止劳动合同的证明，并在十五日内为劳动者办理档案和社会保险关系转移手续。劳动者应当按照双方约定，办理工作交接。用人单位依照本法有关规定应当向劳动者支付经济补偿的，在办结工作交接时支付。用人单位对已经解除或者终止的劳动合同的文本，至少保存二年备查。-法律依据：《劳动合同法》第五十条用人单位应当在解除或者终止劳动合同时出具解除或者终止劳动合同的证明，并在十五日内为劳动者办理档案和社会保险关系转移手续。劳动者应当按照双方约定，办理工作交接。用人单位依照本法有关规定应当向劳动者支付经济补偿的，在办结工作交接时支付。用人单位对已经解除或者终止的劳动合同的文本，至少保存二年备查。,回答
问工伤事故赔偿标准有哪些规定,问题,专业回答,工伤事故赔偿标准规定在《工伤保险条例》第三十三条中：职工因工作遭受事故伤害或者患职业病需要暂停工作接受工伤医疗的，在停工留薪期内，原工资福利待遇不变，由所在单位按月支付。停工留薪期一般不超过12个月。伤情严重或者情况特殊，经设区的市级劳动能力鉴定委员会确认，可以适当延长，但延长不得超过12个月。工伤职工评定伤残等级后，停发原待遇，按照本章的有关规定享受伤残待遇。工伤职工在停工留薪期满后仍需治疗的，继续享受工伤医疗待遇。生活不能自理的工伤职工在停工留薪期需要护理的，由所在单位负责。-法律依据：工伤保险条例第三十三条职工因工作遭受事故伤害或者患职业病需要暂停工作接受工伤医疗的，在停工留薪期内，原工资福利待遇不变，由所在单位按月支付。停工留薪期一般不超过12个月。伤情严重或者情况特殊，经设区的市级劳动能力鉴定委员会确认，可以适当延长，但延长不得超过12个月。工伤职工评定伤残等级后，停发原待遇，按照本章的有关规定享受伤残待遇。工伤职工在停工留薪期满后仍需治疗的，继续享受工伤医疗待遇。生活不能自理的工伤职工在停工留薪期需要护理的，由所在单位负责。,回答
问在我国工伤鉴定在什么地方做,问题,专业回答,在我国工伤鉴定在设区的市级劳动能力鉴定委员会。《工伤保险条例》第二十三条规定，劳动能力鉴定由用人单位、工伤职工或者其近亲属向设区的市级劳动能力鉴定委员会提出申请，并提供工伤认定决定和职工工伤医疗的有关资料。第二十四条规定，省、自治区、直辖市劳动能力鉴定委员会和设区的市级劳动能力鉴定委员会分别由省、自治区、直辖市和设区的市级社会保险行政部门、卫生行政部门、工会组织、经办机构代表以及用人单位代表组成。劳动能力鉴定委员会建立医疗卫生专家库。列入专家库的医疗卫生专业技术人员应当具备下列条件：（一）具有医疗卫生高级专业技术职务任职资格；（二）掌握劳动能力鉴定的相关知识；（三）具有良好的职业品德。-法律依据：工伤保险条例第二十三条劳动能力鉴定由用人单位、工伤职工或者其近亲属向设区的市级劳动能力鉴定委员会提出申请，并提供工伤认定决定和职工工伤医疗的有关资料。工伤保险条例第二十四条省、自治区、直辖市劳动能力鉴定委员会和设区的市级劳动能力鉴定委员会分别由省、自治区、直辖市和设区的市级社会保险行政部门、卫生行政部门、工会组织、经办机构代表以及用人单位代表组成。,回答
问劳动合同辞职违约金需要支付吗,问题,专业回答,劳动者辞职一般不需要支付违约金。但劳动者违反服务期约定的，应当按照约定向用人单位支付违约金。《劳动合同法》第二十二条规定，用人单位为劳动者提供专项培训费用，对其进行专业技术培训的，可以与该劳动者订立协议，约定服务期。劳动者违反服务期约定的，应当按照约定向用人单位支付违约金。违约金的数额不得超过用人单位提供的培训费用。用人单位要求劳动者支付的违约金不得超过服务期尚未履行部分所应分摊的培训费用。用人单位与劳动者约定服务期的，不影响按照正常的工资调整机制提高劳动者在服务期期间的劳动报酬。-法律依据：中华人民共和国劳动合同法第二十二条用人单位为劳动者提供专项培训费用，对其进行专业技术培训的，可以与该劳动者订立协议，约定服务期。劳动者违反服务期约定的，应当按照约定向用人单位支付违约金。违约金的数额不得超过用人单位提供的培训费用。用人单位要求劳动者支付的违约金不得超过服务期尚未履行部分所应分摊的培训费用。用人单位与劳动者约定服务期的，不影响按照正常的工资调整机制提高劳动者在服务期期间的劳动报酬。,回答
问工作餐吃鱼卡刺窒息死亡能认定为工伤么,问题,专业回答,工作餐吃鱼卡刺窒息死亡能认定为工伤。职工吃工作餐视为工作内容的延伸。《工伤保险条例》第十四条规定，职工有下列情形之一的，应当认定为工伤：（一）在工作时间和工作场所内，因工作原因受到事故伤害的；（二）工作时间前后在工作场所内，从事与工作有关的预备性或者收尾性工作受到事故伤害的；（三）在工作时间和工作场所内，因履行工作职责受到暴力等意外伤害的；（四）患职业病的；（五）因工外出期间，由于工作原因受到伤害或者发生事故下落不明的；（六）在上下班途中，受到非本人主要责任的交通事故或者城市轨道交通、客运轮渡、火车事故伤害的；（七）法律、行政法规规定应当认定为工伤的其他情形。-法律依据：《工伤保险条例》第十四条职工有下列情形之一的，应当认定为工伤：（一）在工作时间和工作场所内，因工作原因受到事故伤害的；（二）工作时间前后在工作场所内，从事与工作有关的预备性或者收尾性工作受到事故伤害的；（三）在工作时间和工作场所内，因履行工作职责受到暴力等意外伤害的；（四）患职业病的；（五）因工外出期间，由于工作原因受到伤害或者发生事故下落不明的；（六）在上下班途中，受到非本人主要责任的交通事故或者城市轨道交通、客运轮渡、火车事故伤害的；（七）法律、行政法规规定应当认定为工伤的其他情形。,回答
问加班可以调休吗，不加班能扣工资吗,问题,专业回答,用人单位在休息日安排劳动者加班的，可以以调休的方式代替加班工资，不加班不能扣工资。《劳动合同法》第三十一条规定，用人单位应当严格执行劳动定额标准，不得强迫或者变相强迫劳动者加班。用人单位安排加班的，应当按照国家有关规定向劳动者支付加班费。《劳动法》第四十一条规定，用人单位由于生产经营需要，经与工会和劳动者协商后可以延长工作时间，一般每日不得超过一小时；因特殊原因需要延长工作时间的，在保障劳动者身体健康的条件下延长工作时间每日不得超过三小时，但是每月不得超过三十六小时。-法律依据：《劳动合同法》第三十一条用人单位应当严格执行劳动定额标准，不得强迫或者变相强迫劳动者加班。用人单位安排加班的，应当按照国家有关规定向劳动者支付加班费。《劳动法》第四十一条用人单位由于生产经营需要，经与工会和劳动者协商后可以延长工作时间，一般每日不得超过一小时；因特殊原因需要延长工作时间的，在保障劳动者身体健康的条件下延长工作时间每日不得超过三小时，但是每月不得超过三十六小时。,回答
问工伤认定决定书给单位吗,问题,专业回答,工伤认定决定书给受伤害职工（或者其近亲属）和用人单位。《工伤认定办法》第二十二条规定，社会保险行政部门应当自工伤认定决定作出之日起20日内，将《认定工伤决定书》或者《不予认定工伤决定书》送达受伤害职工（或者其近亲属）和用人单位，并抄送社会保险经办机构。《认定工伤决定书》和《不予认定工伤决定书》的送达参照民事法律有关送达的规定执行。-法律依据：《工伤认定办法》第二十二条社会保险行政部门应当自工伤认定决定作出之日起20日内，将《认定工伤决定书》或者《不予认定工伤决定书》送达受伤害职工（或者其近亲属）和用人单位，并抄送社会保险经办机构。《认定工伤决定书》和《不予认定工伤决定书》的送达参照民事法律有关送达的规定执行。,回答
问单位能随意让劳动者加班吗,问题,专业回答,单位不能随意让劳动者加班。一般每日加班不得超过一小时，由此推断每周加班不得超过七小时。《劳动法》第四十一条规定，用人单位由于生产经营需要，经与工会和劳动者协商后可以延长工作时间，一般每日不得超过一小时；因特殊原因需要延长工作时间的，在保障劳动者身体健康的条件下延长工作时间每日不得超过三小时，但是每月不得超过三十六小时。第三十六条规定，国家实行劳动者每日工作时间不超过八小时、平均每周工作时间不超过四十四小时的工时制度。-法律依据：《劳动法》第三十六条国家实行劳动者每日工作时间不超过八小时、平均每周工作时间不超过四十四小时的工时制度。第三十七条对实行计件工作的劳动者，用人单位应当根据本法第三十六条规定的工时制度合理确定其劳动定额和计件报酬标准。第四十一条用人单位由于生产经营需要，经与工会和劳动者协商后可以延长工作时间，一般每日不得超过一小时；因特殊原因需要延长工作时间的，在保障劳动者身体健康的条件下延长工作时间每日不得超过三小时，但是每月不得超过三十六小时。,回答
问发生劳动纠纷能直接起诉吗,问题,专业回答,发生劳动纠纷一般不能直接起诉。发生劳动纠纷后，劳动者想要通过法律途径解决纠纷，首先要在劳动争议仲裁机构进行仲裁，在劳动纠纷发生后的60日内向仲裁机构提出劳动仲裁申请，对仲裁结果不服时，才能到法院提起诉讼，而不能直接提起诉讼。《劳动争议调解仲裁法》第四十八条规定，劳动者对本法第四十七条规定的仲裁裁决不服的，可以自收到仲裁裁决书之日起十五日内向人民法院提起诉讼。-法律依据：《劳动争议调解仲裁法》第四十八条劳动者对本法第四十七条规定的仲裁裁决不服的，可以自收到仲裁裁决书之日起十五日内向人民法院提起诉讼。,回答
问工伤认定资料都有哪些,问题,专业回答,工伤认定资料规定在《工伤保险条例》第十八条中：提出工伤认定申请应当提交下列材料：（一）工伤认定申请表；（二）与用人单位存在劳动关系（包括事实劳动关系）的证明材料；（三）医疗诊断证明或者职业病诊断证明书（或者职业病诊断鉴定书）。工伤认定申请表应当包括事故发生的时间、地点、原因以及职工伤害程度等基本情况。工伤认定申请人提供材料不完整的，社会保险行政部门应当一次性书面告知工伤认定申请人需要补正的全部材料。申请人按照书面告知要求补正材料后，社会保险行政部门应当受理。-法律依据：工伤保险条例第十八条提出工伤认定申请应当提交下列材料：（一）工伤认定申请表；（二）与用人单位存在劳动关系（包括事实劳动关系）的证明材料；（三）医疗诊断证明或者职业病诊断证明书（或者职业病诊断鉴定书）。工伤认定申请表应当包括事故发生的时间、地点、原因以及职工伤害程度等基本情况。工伤认定申请人提供材料不完整的，社会保险行政部门应当一次性书面告知工伤认定申请人需要补正的全部材料。申请人按照书面告知要求补正材料后，社会保险行政部门应当受理。,回答
问如何证明事实劳动关系的存在,问题,专业回答,证明事实劳动关系的存在的证据有：1、工资支付凭证或记录(职工工资发放花名册)、缴纳各项社会保险费的记录；2、用人单位向劳动者发放的“工作证”、“服务证”等能够证明身份的证件；3、劳动者填写的用人单位招工招聘“登记表”、“报名表”等招用记录；4、考勤记录；5、职工名册。《劳动法》第十六条规定，劳动合同是劳动者与用人单位确立劳动关系、明确双方权利和义务的协议。建立劳动关系应当订立劳动合同。-法律依据：《劳动法》第十六条劳动合同是劳动者与用人单位确立劳动关系、明确双方权利和义务的协议。建立劳动关系应当订立劳动合同。,回答
问我国的法律法规到底规定了哪些公假,问题,专业回答,我国的法律法规的公假规定在《劳动法》第四十条中：用人单位在下列节日期间应当依法安排劳动者休假：（一）元旦；（二）春节；（三）国际劳动节；（四）国庆节；（五）法律、法规规定的其他休假节日。(七)国庆节及法律、法规规定的其他休假节日。第五十一条规定，劳动者在法定休假日和婚丧假期间以及依法参加社会活动期间，用人单位应当依法支付工资。-法律依据：《劳动法》第四十条用人单位在下列节日期间应当依法安排劳动者休假：（一）元旦；（二）春节；（三）国际劳动节；（四）国庆节；（五）法律、法规规定的其他休假节日。《劳动法》第五十一条劳动者在法定休假日和婚丧假期间以及依法参加社会活动期间，用人单位应当依法支付工资。,回答
问合同到期员工不续签怎么赔偿金还要赔偿吗,问题,专业回答,劳动合同到期后，如果是员工不愿续约的，一般情况下员工不可以再要求用人单位支付赔偿金。《劳动合同法》第四十六条规定，有下列情形之一的，用人单位应当向劳动者支付经济补偿：（一）劳动者依照本法第三十八条规定解除劳动合同的；（二）用人单位依照本法第三十六条规定向劳动者提出解除劳动合同并与劳动者协商一致解除劳动合同的；（三）用人单位依照本法第四十条规定解除劳动合同的；（四）用人单位依照本法第四十一条第一款规定解除劳动合同的；（五）除用人单位维持或者提高劳动合同约定条件续订劳动合同，劳动者不同意续订的情形外，依照本法第四十四条第一项规定终止固定期限劳动合同的；（六）依照本法第四十四条第四项、第五项规定终止劳动合同的；（七）法律、行政法规规定的其他情形。-法律依据：《劳动合同法》第四十六条有下列情形之一的，用人单位应当向劳动者支付经济补偿：（一）劳动者依照本法第三十八条规定解除劳动合同的；（二）用人单位依照本法第三十六条规定向劳动者提出解除劳动合同并与劳动者协商一致解除劳动合同的；（三）用人单位依照本法第四十条规定解除劳动合同的；（四）用人单位依照本法第四十一条第一款规定解除劳动合同的；（五）除用人单位维持或者提高劳动合同约定条件续订劳动合同，劳动者不同意续订的情形外，依照本法第四十四条第一项规定终止固定期限劳动合同的。,回答
问签了一年劳动合同是否可以,问题,专业回答,签了一年劳动合同是可以的。用人单位与劳动者协商一致，可以订立固定期限劳动合同。劳动合同的签订以双方当事人自愿为前提，只要双方协商达成一致，时间等内容可以由双方自行协商。根据《劳动合同法》第十三条规定，固定期限劳动合同，是指用人单位与劳动者约定合同终止时间的劳动合同。用人单位与劳动者协商一致，可以订立固定期限劳动合同。-法律依据：中华人民共和国劳动合同法第十三条固定期限劳动合同，是指用人单位与劳动者约定合同终止时间的劳动合同。用人单位与劳动者协商一致，可以订立固定期限劳动合同。,回答
问超过一月不签劳动合同会有怎样的后果,问题,专业回答,用人单位超过一个月不满一年不签劳动合同，应当向劳动者每月支付二倍的工资。员工可以随时解除劳动合同，且不承担任何违约责任或者赔偿。《劳动合同法》第八十二条规定，用人单位自用工之日起超过一个月不满一年未与劳动者订立书面劳动合同的，应当向劳动者每月支付二倍的工资。用人单位违反本法规定不与劳动者订立无固定期限劳动合同的，自应当订立无固定期限劳动合同之日起向劳动者每月支付二倍的工资。-法律依据：中华人民共和国劳动合同法第八十二条用人单位自用工之日起超过一个月不满一年未与劳动者订立书面劳动合同的，应当向劳动者每月支付二倍的工资。用人单位违反本法规定不与劳动者订立无固定期限劳动合同的，自应当订立无固定期限劳动合同之日起向劳动者每月支付二倍的工资。,回答
问签订劳动合同的维权要点包括哪些,问题,专业回答,签订劳动合同的维权要点包括：1、清楚单位的基本情况，判断是否是合法企业，法人代表姓名、单位地址、电话；2、注意清楚自己的具体工作，并在合同中表明工作的内容和具体地点；3、劳动报酬要定清楚，避免口头约定；4、劳动报酬的支付方式与支付时间要明确；5、劳动者工作条件要明确；6、社会保险约定。《劳动合同法》第十条规定，建立劳动关系，应当订立书面劳动合同。已建立劳动关系，未同时订立书面劳动合同的，应当自用工之日起一个月内订立书面劳动合同。-法律依据：《劳动合同法》第十条建立劳动关系，应当订立书面劳动合同。已建立劳动关系，未同时订立书面劳动合同的，应当自用工之日起一个月内订立书面劳动合同。,回答
问一般加班费是怎样计算的,问题,专业回答,加班费计算方式规定在《劳动法》第四十四条中：有下列情形之一的，用人单位应当按照下列标准支付高于劳动者正常工作时间工资的工资报酬：（一）安排劳动者延长工作时间的，支付不低于工资的百分之一百五十的工资报酬；（二）休息日安排劳动者工作又不能安排补休的，支付不低于工资的百分之二百的工资报酬；（三）法定休假日安排劳动者工作的，支付不低于工资的百分之三百的工资报酬。-法律依据：《劳动法》第四十四条有下列情形之一的，用人单位应当按照下列标准支付高于劳动者正常工作时间工资的工资报酬：（一）安排劳动者延长工作时间的，支付不低于工资的百分之一百五十的工资报酬；（二）休息日安排劳动者工作又不能安排补休的，支付不低于工资的百分之二百的工资报酬；（三）法定休假日安排劳动者工作的，支付不低于工资的百分之三百的工资报酬。,回答
问企业能否使用未成年工,问题,专业回答,企业能使用未成年工。但不得安排未成年工从事矿山井下、有毒有害、国家规定的第四级体力劳动强度的劳动和其他禁忌从事的劳动。《劳动法》第五十八条规定，国家对女职工和未成年工实行特殊劳动保护。未成年工是指年满十六周岁未满十八周岁的劳动者。第六十四条规定，不得安排未成年工从事矿山井下、有毒有害、国家规定的第四级体力劳动强度的劳动和其他禁忌从事的劳动。第六十五条规定，用人单位应当对未成年工定期进行健康检查。第九十五条规定，用人单位违反本法对女职工和未成年工的保护规定，侵害其合法权益的，由劳动行政部门责令改正，处以罚款；对女职工或者未成年工造成损害的，应当承担赔偿责任。-法律依据：中华人民共和国劳动法第五十八条国家对女职工和未成年工实行特殊劳动保护。未成年工是指年满十六周岁未满十八周岁的劳动者。中华人民共和国劳动法第六十四条不得安排未成年工从事矿山井下、有毒有害、国家规定的第四级体力劳动强度的劳动和其他禁忌从事的劳动。中华人民共和国劳动法第六十五条用人单位应当对未成年工定期进行健康检查。,回答
问工会组织工伤认定时效是多久,问题,专业回答,工会组织工伤认定时效是30天。《工伤保险条例》第十七条第一款、第二款规定，职工发生事故伤害或者按照职业病防治法规定被诊断、鉴定为职业病，所在单位应当自事故伤害发生之日或者被诊断、鉴定为职业病之日起30日内，向统筹地区社会保险行政部门提出工伤认定申请。遇有特殊情况，经报社会保险行政部门同意，申请时限可以适当延长。用人单位未按前款规定提出工伤认定申请的，工伤职工或者其近亲属、工会组织在事故伤害发生之日或者被诊断、鉴定为职业病之日起1年内，可以直接向用人单位所在地统筹地区社会保险行政部门提出工伤认定申请。-法律依据：《工伤保险条例》第十七条第一、二款职工发生事故伤害或者按照职业病防治法规定被诊断、鉴定为职业病，所在单位应当自事故伤害发生之日或者被诊断、鉴定为职业病之日起30日内，向统筹地区社会保险行政部门提出工伤认定申请。遇有特殊情况，经报社会保险行政部门同意，申请时限可以适当延长。用人单位未按前款规定提出工伤认定申请的，工伤职工或者其近亲属、工会组织在事故伤害发生之日或者被诊断、鉴定为职业病之日起1年内，可以直接向用人单位所在地统筹地区社会保险行政部门提出工伤认定申请。,回答
