question,question_tag,property,answer,answer_tag
问在试用期解除劳动合同有什么限制,问题,专业回答,在试用期解除劳动，除劳动者有劳动合同法第三十九条和第四十条第一项、第二项规定的情形外，用人单位不得解除劳动合同。根据《劳动合同法》第三十九条第一款规定，劳动者在试用期间被证明不符合录用条件的，用人单位可以解除劳动合同。第四十条第一款第一项、第二项规定，有下列情形之一的，用人单位提前三十日以书面形式通知劳动者本人或者额外支付劳动者一个月工资后，可以解除劳动合同：（一）劳动者患病或者非因工负伤，在规定的医疗期满后不能从事原工作，也不能从事由用人单位另行安排的工作的；（二）劳动者不能胜任工作，经过培训或者调整工作岗位，仍不能胜任工作的。-法律依据：《劳动合同法》第三十九条劳动者有下列情形之一的，用人单位可以解除劳动合同：（一）在试用期间被证明不符合录用条件的；（二）严重违反用人单位的规章制度的；（三）严重失职，营私舞弊，给用人单位造成重大损害的；（四）劳动者同时与其他用人单位建立劳动关系，对完成本单位的工作任务造成严重影响，或者经用人单位提出，拒不改正的；（五）因本法第二十六条第一款第一项规定的情形致使劳动合同无效的；（六）被依法追究刑事责任的。,回答
问单位单方面解除劳动关系原因有什么,问题,专业回答,根据《劳动合同法》第三十九条规定，单位单方面解除劳动关系原因有：（一）在试用期间被证明不符合录用条件的；（二）严重违反用人单位的规章制度的；（三）严重失职，营私舞弊，给用人单位造成重大损害的；（四）劳动者同时与其他用人单位建立劳动关系，对完成本单位的工作任务造成严重影响，或者经用人单位提出，拒不改正的；（五）因本法第二十六条第一款第一项规定的情形致使劳动合同无效的；（六）被依法追究刑事责任的。-法律依据：《劳动合同法》第三十九条劳动者有下列情形之一的，用人单位可以解除劳动合同：（一）在试用期间被证明不符合录用条件的；（二）严重违反用人单位的规章制度的；（三）严重失职，营私舞弊，给用人单位造成重大损害的；（四）劳动者同时与其他用人单位建立劳动关系，对完成本单位的工作任务造成严重影响，或者经用人单位提出，拒不改正的；（五）因本法第二十六条第一款第一项规定的情形致使劳动合同无效的；（六）被依法追究刑事责任的。,回答
问工伤鉴定需要鉴定费吗,问题,专业回答,工伤鉴定需要鉴定费。根据《工伤保险条例》第十二条规定，工伤保险基金存入社会保障基金财政专户，用于本条例规定的工伤保险待遇，劳动能力鉴定，工伤预防的宣传、培训等费用，以及法律、法规规定的用于工伤保险的其他费用的支付。工伤预防费用的提取比例、使用和管理的具体办法，由国务院社会保险行政部门会同国务院财政、卫生行政、安全生产监督管理等部门规定。任何单位或者个人不得将工伤保险基金用于投资运营、兴建或者改建办公场所、发放奖金，或者挪作其他用途。-法律依据：工伤保险条例第七条工伤保险基金由用人单位缴纳的工伤保险费、工伤保险基金的利息和依法纳入工伤保险基金的其他资金构成。工伤保险条例第十二条工伤保险基金存入社会保障基金财政专户，用于本条例规定的工伤保险待遇，劳动能力鉴定，工伤预防的宣传、培训等费用，以及法律、法规规定的用于工伤保险的其他费用的支付。工伤预防费用的提取比例、使用和管理的具体办法，由国务院社会保险行政部门会同国务院财政、卫生行政、安全生产监督管理等部门规定。任何单位或者个人不得将工伤保险基金用于投资运营、兴建或者改建办公场所、发放奖金，或者挪作其他用途。,回答
问提前解除劳动合同违约吗,问题,专业回答,提前解除劳动合同是否违约根据具体情况决定，依法提前解除劳动合同的，不违约，例如劳动者提前三十日书面通知用人单位，用人单位无过失性辞退劳动者；违法法规提前解除劳动合同的，属于违约行为，应当承担赔偿义务。根据《劳动合同法》第三十七条规定，劳动者提前三十日以书面形式通知用人单位，可以解除劳动合同。劳动者在试用期内提前三日通知用人单位，可以解除劳动合同。-法律依据：《劳动合同法》第三十七条劳动者提前三十日以书面形式通知用人单位，可以解除劳动合同。劳动者在试用期内提前三日通知用人单位，可以解除劳动合同。,回答
问没有劳动合同能申请工伤鉴定吗,问题,专业回答,没有劳动合同，提供劳动关系证明的，能申请工伤鉴定。根据《工伤保险条例》第十八条规定，提出工伤认定申请应当提交下列材料：（一）工伤认定申请表；（二）与用人单位存在劳动关系（包括事实劳动关系）的证明材料；（三）医疗诊断证明或者职业病诊断证明书（或者职业病诊断鉴定书）。工伤认定申请表应当包括事故发生的时间、地点、原因以及职工伤害程度等基本情况。工伤认定申请人提供材料不完整的，社会保险行政部门应当一次性书面告知工伤认定申请人需要补正的全部材料。申请人按照书面告知要求补正材料后，社会保险行政部门应当受理。-法律依据：《工伤保险条例》第十八条提出工伤认定申请应当提交下列材料：（一）工伤认定申请表；（二）与用人单位存在劳动关系（包括事实劳动关系）的证明材料；（三）医疗诊断证明或者职业病诊断证明书（或者职业病诊断鉴定书）。工伤认定申请表应当包括事故发生的时间、地点、原因以及职工伤害程度等基本情况。工伤认定申请人提供材料不完整的，社会保险行政部门应当一次性书面告知工伤认定申请人需要补正的全部材料。申请人按照书面告知要求补正材料后，社会保险行政部门应当受理。,回答
问劳动法对劳动时间有怎样的规定,问题,专业回答,根据《劳动法》第三十六条、第四十一条规定，劳动法对劳动时间的规定有：1、国家实行劳动者每日工作时间不超过八小时、平均每周工作时间不超过四十四小时的工时制度。2、用人单位由于生产经营需要，经与工会和劳动者协商后可以延长工作时间，一般每日不得超过一小时；因特殊原因需要延长工作时间的，在保障劳动者身体健康的条件下延长工作时间每日不得超过三小时，但是每月不得超过三十六小时。-法律依据：《劳动法》第三十六条国家实行劳动者每日工作时间不超过八小时、平均每周工作时间不超过四十四小时的工时制度。《劳动法》第四十一条用人单位由于生产经营需要，经与工会和劳动者协商后可以延长工作时间，一般每日不得超过一小时；因特殊原因需要延长工作时间的，在保障劳动者身体健康的条件下延长工作时间每日不得超过三小时，但是每月不得超过三十六小时。,回答
问劳动法试用期离职规定有哪些,问题,专业回答,试用期离职，应当提前三日通知用人单位。试用期是用人单位和劳动者为相互了解、选择而约定的考察期，既是用人单位考查劳动者是否具备录用条件的考察期限，也是劳动者选择用人单位的选择期限。劳动者在试用期内，认为无须继续履行合同的，可以在较短时间内通知用人单位予以解除劳动合同。根据《劳动合同法》第三十七条规定，劳动者提前三十日以书面形式通知用人单位，可以解除劳动合同。劳动者在试用期内提前三日通知用人单位，可以解除劳动合同。-法律依据：《劳动合同法》第三十七条劳动者提前三十日以书面形式通知用人单位，可以解除劳动合同。劳动者在试用期内提前三日通知用人单位，可以解除劳动合同。,回答
问降薪调岗赔偿怎么计算,问题,专业回答,降薪调岗赔偿，按劳动者工作年限计算，每满一年支付一个月工资，六个月以上不满一年的，按一年计算，不满六个月的，支付半个月的工资。根据《劳动合同法》第四十七条规定，经济补偿按劳动者在本单位工作的年限，每满一年支付一个月工资的标准向劳动者支付。六个月以上不满一年的，按一年计算；不满六个月的，向劳动者支付半个月工资的经济补偿。劳动者月工资高于用人单位所在直辖市、设区的市级人民政府公布的本地区上年度职工月平均工资三倍的，向其支付经济补偿的标准按职工月平均工资三倍的数额支付，向其支付经济补偿的年限最高不超过十二年。本条所称月工资是指劳动者在劳动合同解除或者终止前十二个月的平均工资。-法律依据：《劳动合同法》第四十七条经济补偿按劳动者在本单位工作的年限，每满一年支付一个月工资的标准向劳动者支付。六个月以上不满一年的，按一年计算；不满六个月的，向劳动者支付半个月工资的经济补偿。劳动者月工资高于用人单位所在直辖市、设区的市级人民政府公布的本地区上年度职工月平均工资三倍的，向其支付经济补偿的标准按职工月平均工资三倍的数额支付，向其支付经济补偿的年限最高不超过十二年。本条所称月工资是指劳动者在劳动合同解除或者终止前十二个月的平均工资。,回答
问员工到劳动局申请工伤鉴定要哪些材料,问题,专业回答,根据《工伤保险条例》第十八条规定，员工到劳动局申请工伤鉴定需要的材料有：（一）工伤认定申请表；（二）与用人单位存在劳动关系（包括事实劳动关系）的证明材料；（三）医疗诊断证明或者职业病诊断证明书（或者职业病诊断鉴定书）。工伤认定申请表应当包括事故发生的时间、地点、原因以及职工伤害程度等基本情况。工伤认定申请人提供材料不完整的，社会保险行政部门应当一次性书面告知工伤认定申请人需要补正的全部材料。申请人按照书面告知要求补正材料后，社会保险行政部门应当受理。-法律依据：工伤保险条例第十八条提出工伤认定申请应当提交下列材料：（一）工伤认定申请表；（二）与用人单位存在劳动关系（包括事实劳动关系）的证明材料；（三）医疗诊断证明或者职业病诊断证明书（或者职业病诊断鉴定书）。工伤认定申请表应当包括事故发生的时间、地点、原因以及职工伤害程度等基本情况。工伤认定申请人提供材料不完整的，社会保险行政部门应当一次性书面告知工伤认定申请人需要补正的全部材料。申请人按照书面告知要求补正材料后，社会保险行政部门应当受理。,回答
问申请劳动仲裁的时效有多长时间呢,问题,专业回答,申请劳动仲裁的时效是一年。根据《劳动争议调解仲裁法》第二十七条第一、二、三款规定，劳动争议申请仲裁的时效期间为一年。仲裁时效期间从当事人知道或者应当知道其权利被侵害之日起计算。前款规定的仲裁时效，因当事人一方向对方当事人主张权利，或者向有关部门请求权利救济，或者对方当事人同意履行义务而中断。从中断时起，仲裁时效期间重新计算。因不可抗力或者有其他正当理由，当事人不能在本条第一款规定的仲裁时效期间申请仲裁的，仲裁时效中止。从中止时效的原因消除之日起，仲裁时效期间继续计算。-法律依据：《劳动争议调解仲裁法》第二十七条劳动争议申请仲裁的时效期间为一年。仲裁时效期间从当事人知道或者应当知道其权利被侵害之日起计算。前款规定的仲裁时效，因当事人一方向对方当事人主张权利，或者向有关部门请求权利救济，或者对方当事人同意履行义务而中断。从中断时起，仲裁时效期间重新计算。因不可抗力或者有其他正当理由，当事人不能在本条第一款规定的仲裁时效期间申请仲裁的，仲裁时效中止。从中止时效的原因消除之日起，仲裁时效期间继续计算。,回答
问怀孕期间能否可以调岗降薪,问题,专业回答,女职工怀孕期间，用人单位不可以以怀孕为由调岗降薪，用人单位与女职工协商一致的，可以变更劳动合同调岗降薪。根据《女职工劳动保护特别规定》第五条规定，用人单位不得因女职工怀孕、生育、哺乳降低其工资、予以辞退、与其解除劳动或者聘用合同。《劳动合同法》第三十五条规定，用人单位与劳动者协商一致，可以变更劳动合同约定的内容。变更劳动合同，应当采用书面形式。变更后的劳动合同文本由用人单位和劳动者各执一份。-法律依据：女职工劳动保护特别规定第五条用人单位不得因女职工怀孕、生育、哺乳降低其工资、予以辞退、与其解除劳动或者聘用合同。中华人民共和国劳动合同法第三十五条用人单位与劳动者协商一致，可以变更劳动合同约定的内容。变更劳动合同，应当采用书面形式。变更后的劳动合同文本由用人单位和劳动者各执一份。,回答
问用人单位辞退的条件包括哪些,问题,专业回答,根据《劳动合同法》第三十九条规定，用人单位辞退的条件包括：（一）在试用期间被证明不符合录用条件的；（二）严重违反用人单位的规章制度的；（三）严重失职，营私舞弊，给用人单位造成重大损害的；（四）劳动者同时与其他用人单位建立劳动关系，对完成本单位的工作任务造成严重影响，或者经用人单位提出，拒不改正的；（五）因本法第二十六条第一款第一项规定的情形致使劳动合同无效的；（六）被依法追究刑事责任的。-法律依据：《劳动合同法》第三十九条劳动者有下列情形之一的，用人单位可以解除劳动合同：（一）在试用期间被证明不符合录用条件的；（二）严重违反用人单位的规章制度的；（三）严重失职，营私舞弊，给用人单位造成重大损害的；（四）劳动者同时与其他用人单位建立劳动关系，对完成本单位的工作任务造成严重影响，或者经用人单位提出，拒不改正的；（五）因本法第二十六条第一款第一项规定的情形致使劳动合同无效的；（六）被依法追究刑事责任的。,回答
问被公司辞退后如何进行经济补偿,问题,专业回答,劳动者被公司辞退后，公司按劳动者在本单位工作的年限，每满一年支付一个月工资的标准向劳动者支付补偿金，公司违法解除劳动合同的，应当支付二倍赔偿金。根据《劳动合同法》第四十七条第一、二款规定，经济补偿按劳动者在本单位工作的年限，每满一年支付一个月工资的标准向劳动者支付。六个月以上不满一年的，按一年计算；不满六个月的，向劳动者支付半个月工资的经济补偿。劳动者月工资高于用人单位所在直辖市、设区的市级人民政府公布的本地区上年度职工月平均工资三倍的，向其支付经济补偿的标准按职工月平均工资三倍的数额支付，向其支付经济补偿的年限最高不超过十二年。-法律依据：《劳动合同法》第四十七条经济补偿按劳动者在本单位工作的年限，每满一年支付一个月工资的标准向劳动者支付。六个月以上不满一年的，按一年计算；不满六个月的，向劳动者支付半个月工资的经济补偿。劳动者月工资高于用人单位所在直辖市、设区的市级人民政府公布的本地区上年度职工月平均工资三倍的，向其支付经济补偿的标准按职工月平均工资三倍的数额支付，向其支付经济补偿的年限最高不超过十二年。本条所称月工资是指劳动者在劳动合同解除或者终止前十二个月的平均工资。,回答
问申请工伤认定多少时间能办下来,问题,专业回答,一般60日可以办下工伤认定申请。根据《工伤保险条例》第二十条规定，社会保险行政部门应当自受理工伤认定申请之日起60日内作出工伤认定的决定，并书面通知申请工伤认定的职工或者其近亲属和该职工所在单位。社会保险行政部门对受理的事实清楚、权利义务明确的工伤认定申请，应当在15日内作出工伤认定的决定。作出工伤认定决定需要以司法机关或者有关行政主管部门的结论为依据的，在司法机关或者有关行政主管部门尚未作出结论期间，作出工伤认定决定的时限中止。社会保险行政部门工作人员与工伤认定申请人有利害关系的，应当回避。-法律依据：《工伤保险条例》第二十条社会保险行政部门应当自受理工伤认定申请之日起60日内作出工伤认定的决定，并书面通知申请工伤认定的职工或者其近亲属和该职工所在单位。社会保险行政部门对受理的事实清楚、权利义务明确的工伤认定申请，应当在15日内作出工伤认定的决定。作出工伤认定决定需要以司法机关或者有关行政主管部门的结论为依据的，在司法机关或者有关行政主管部门尚未作出结论期间，作出工伤认定决定的时限中止。社会保险行政部门工作人员与工伤认定申请人有利害关系的，应当回避。,回答
问劳务派遣用工单位调岗降薪是否合法,问题,专业回答,劳务派遣用工单位调岗降薪不合法，用工单位变更协议，应当与派遣单位、派遣劳动者协商一致，无法达成协商一致的，应当按照原协议约定继续履行。根据《劳动合同法》第五十八条规定，劳务派遣单位是本法所称用人单位，应当履行用人单位对劳动者的义务。劳务派遣单位与被派遣劳动者订立的劳动合同，除应当载明本法第十七条规定的事项外，还应当载明被派遣劳动者的用工单位以及派遣期限、工作岗位等情况。劳务派遣单位应当与被派遣劳动者订立二年以上的固定期限劳动合同，按月支付劳动报酬；被派遣劳动者在无工作期间，劳务派遣单位应当按照所在地人民政府规定的最低工资标准，向其按月支付报酬。-法律依据：《劳动合同法》第五十八条劳务派遣单位是本法所称用人单位，应当履行用人单位对劳动者的义务。劳务派遣单位与被派遣劳动者订立的劳动合同，除应当载明本法第十七条规定的事项外，还应当载明被派遣劳动者的用工单位以及派遣期限、工作岗位等情况。劳务派遣单位应当与被派遣劳动者订立二年以上的固定期限劳动合同，按月支付劳动报酬；被派遣劳动者在无工作期间，劳务派遣单位应当按照所在地人民政府规定的最低工资标准，向其按月支付报酬。,回答
问自动离职后劳动合同是否解除,问题,专业回答,自动离职后劳动合同解除，劳动者提前三十日书面形式通知用人单位的，自动离职后即可解除劳动合同；劳动者严重违反规章制度擅自离职的，用人单位可以解除劳动合同。根据《劳动合同法》第三十九条规定，劳动者有下列情形之一的，用人单位可以解除劳动合同：（一）在试用期间被证明不符合录用条件的；（二）严重违反用人单位的规章制度的；（三）严重失职，营私舞弊，给用人单位造成重大损害的；（四）劳动者同时与其他用人单位建立劳动关系，对完成本单位的工作任务造成严重影响，或者经用人单位提出，拒不改正的；（五）因本法第二十六条第一款第一项规定的情形致使劳动合同无效的；（六）被依法追究刑事责任的。-法律依据：《劳动合同法》第三十九条劳动者有下列情形之一的，用人单位可以解除劳动合同：（一）在试用期间被证明不符合录用条件的；（二）严重违反用人单位的规章制度的；（三）严重失职，营私舞弊，给用人单位造成重大损害的；（四）劳动者同时与其他用人单位建立劳动关系，对完成本单位的工作任务造成严重影响，或者经用人单位提出，拒不改正的；（五）因本法第二十六条第一款第一项规定的情形致使劳动合同无效的；（六）被依法追究刑事责任的。,回答
问公司能否任意安排员工加班,问题,专业回答,公司不可以任意安排员工加班。根据《劳动法》第四十一条规定，用人单位由于生产经营需要，经与工会和劳动者协商后可以延长工作时间，一般每日不得超过一小时；因特殊原因需要延长工作时间的，在保障劳动者身体健康的条件下延长工作时间每日不得超过三小时，但是每月不得超过三十六小时。《劳动合同法》第三十一条规定，用人单位应当严格执行劳动定额标准，不得强迫或者变相强迫劳动者加班。用人单位安排加班的，应当按照国家有关规定向劳动者支付加班费。-法律依据：《劳动法》第三十八条用人单位应当保证劳动者每周至少休息一日。第四十一条用人单位由于生产经营需要，经与工会和劳动者协商后可以延长工作时间，一般每日不得超过一小时；因特殊原因需要延长工作时间的，在保障劳动者身体健康的条件下延长工作时间每日不得超过三小时，但是每月不得超过三十六小时。《劳动合同法》第三十一条用人单位应当严格执行劳动定额标准，不得强迫或者变相强迫劳动者加班。用人单位安排加班的，应当按照国家有关规定向劳动者支付加班费。,回答
问劳动者是否可以拒绝调岗位降薪,问题,专业回答,劳动者可以拒绝调岗位降薪。调岗位降薪应当取得劳动者的同意，劳动合同变更条件是用人单位与劳动者协商一致，未对变更劳动合同约定的内容达成一致意见的，不得变更劳动合同。根据《劳动合同法》第三十五条规定，用人单位与劳动者协商一致，可以变更劳动合同约定的内容。变更劳动合同，应当采用书面形式。变更后的劳动合同文本由用人单位和劳动者各执一份。《民法典》第五百四十三条规定，当事人协商一致，可以变更合同。-法律依据：《劳动合同法》第三十五条用人单位与劳动者协商一致，可以变更劳动合同约定的内容。变更劳动合同，应当采用书面形式。变更后的劳动合同文本由用人单位和劳动者各执一份。《民法典》第五百四十三条当事人协商一致，可以变更合同。,回答
问满了16还算童工吗,问题,专业回答,满了16不算童工，童工是指未满16周岁的儿童或少年工人。根据《禁止使用童工规定》第二条规定，国家机关、社会团体、企业事业单位、民办非企业单位或者个体工商户（以下统称用人单位）均不得招用不满16周岁的未成年人（招用不满16周岁的未成年人，以下统称使用童工）。禁止任何单位或者个人为不满16周岁的未成年人介绍就业。禁止不满16周岁的未成年人开业从事个体经营活动。《劳动法》第五十八条规定，国家对女职工和未成年工实行特殊劳动保护。未成年工是指年满十六周岁未满十八周岁的劳动者。-法律依据：《禁止使用童工规定》第二条国家机关、社会团体、企业事业单位、民办非企业单位或者个体工商户（以下统称用人单位）均不得招用不满16周岁的未成年人（招用不满16周岁的未成年人，以下统称使用童工）。禁止任何单位或者个人为不满16周岁的未成年人介绍就业。禁止不满16周岁的未成年人开业从事个体经营活动。《劳动法》第五十八条国家对女职工和未成年工实行特殊劳动保护。未成年工是指年满十六周岁未满十八周岁的劳动者。,回答
