question,question_tag,property,answer,answer_tag
略,问题,专业回答,略-略,回答
问工伤脸上留疤赔偿是由用人单位支付吗,问题,专业回答,如果脸部的伤疤是在工作中造成的，经过劳动部门确认为工伤之后，职工的医疗费用将由用人单位支付。伤疤严重到不能到用人单位上班的，可以申请停工留薪，并且用人单位每月要按时支付工资给职工，不可以无故克扣工资。根据《工伤保险条例》第三十条第一、二款规定，职工因工作遭受事故伤害或者患职业病进行治疗，享受工伤医疗待遇。职工治疗工伤应当在签订服务协议的医疗机构就医，情况紧急时可以先到就近的医疗机构急救。-法律依据：《工伤保险条例》第三十条职工因工作遭受事故伤害或者患职业病进行治疗，享受工伤医疗待遇。职工治疗工伤应当在签订服务协议的医疗机构就医，情况紧急时可以先到就近的医疗机构急救。治疗工伤所需费用符合工伤保险诊疗项目目录、工伤保险药品目录、工伤保险住院服务标准的，从工伤保险基金支付。工伤保险诊疗项目目录、工伤保险药品目录、工伤保险住院服务标准，由国务院社会保险行政部门会同国务院卫生行政部门、食品药品监督管理部门等部门规定。,回答
问未满18满16周岁算童工吗,问题,专业回答,未满18满16周岁的不算童工。禁止用人单位招收未满16周岁的未成年人。用人单位非法招用未满16周岁的未成年人的，由劳动行政部门责令改正，处以罚款；情节严重的，由工商行政部门吊销营业执照。根据《禁止使用童工规定》第二条规定，国家机关、社会团体、企业事业单位、民办非企业单位或者个体工商户（以下统称用人单位）均不得招用不满16周岁的未成年人（招用不满16周岁的未成年人，以下统称使用童工）。禁止任何单位或者个人为不满16周岁的未成年人介绍就业。禁止不满16周岁的未成年人开业从事个体经营活动。-法律依据：禁止使用童工规定第二条国家机关、社会团体、企业事业单位、民办非企业单位或者个体工商户（以下统称用人单位）均不得招用不满16周岁的未成年人（招用不满16周岁的未成年人，以下统称使用童工）。禁止任何单位或者个人为不满16周岁的未成年人介绍就业。禁止不满16周岁的未成年人开业从事个体经营活动。,回答
问用人单位能不能辞退怀孕的女职工,问题,专业回答,用人单位一般是不能辞退怀孕的女职工的。女职工在孕期、产期、哺乳期的，用人单位不得解除劳动合同。用人单位违反本法规定解除或者终止劳动合同的，应当向劳动者支付赔偿金。根据《劳动合同法》第四十八条规定，用人单位违反本法规定解除或者终止劳动合同，劳动者要求继续履行劳动合同的，用人单位应当继续履行；劳动者不要求继续履行劳动合同或者劳动合同已经不能继续履行的，用人单位应当依照本法第八十七条规定支付赔偿金。-法律依据：《劳动合同法》第四十八条用人单位违反本法规定解除或者终止劳动合同，劳动者要求继续履行劳动合同的，用人单位应当继续履行；劳动者不要求继续履行劳动合同或者劳动合同已经不能继续履行的，用人单位应当依照本法第八十七条规定支付赔偿金。,回答
问员工存在劳动关系不上班可以解雇吗,问题,专业回答,员工存在劳动关系不上班的，如果有法定可以解除的情形，用人单位可以解雇并且无需支付经济补偿金。根据《劳动合同法》第三十九条规定，劳动者有下列情形之一的，用人单位可以解除劳动合同：（一）在试用期间被证明不符合录用条件的；（二）严重违反用人单位的规章制度的；（三）严重失职，营私舞弊，给用人单位造成重大损害的；（四）劳动者同时与其他用人单位建立劳动关系，对完成本单位的工作任务造成严重影响，或者经用人单位提出，拒不改正的；（五）因本法第二十六条第一款第一项规定的情形致使劳动合同无效的；（六）被依法追究刑事责任的。-法律依据：《劳动合同法》第三十九条劳动者有下列情形之一的，用人单位可以解除劳动合同：（一）在试用期间被证明不符合录用条件的；（二）严重违反用人单位的规章制度的；（三）严重失职，营私舞弊，给用人单位造成重大损害的；（四）劳动者同时与其他用人单位建立劳动关系，对完成本单位的工作任务造成严重影响，或者经用人单位提出，拒不改正的；（五）因本法第二十六条第一款第一项规定的情形致使劳动合同无效的；（六）被依法追究刑事责任的。,回答
问哪些情形会违反劳动合同,问题,专业回答,劳动者有下列情形之一的，用人单位不得解除劳动合同：（一）从事接触职业病危害作业的劳动者未进行离岗前职业健康检查，或者疑似职业病病人在诊断或者医学观察期间的；（二）在本单位患职业病或者因工负伤并被确认丧失或者部分丧失劳动能力的；（三）患病或者非因工负伤，在规定的医疗期内的。根据《劳动合同法》第四十八条规定，用人单位违反本法规解除或者终止劳动合同，劳动者要求继续履行劳动合同的，用人单位应当继续履行；劳动者不要求继续履行劳动合同或者劳动合同已经不能继续履行的，用人单位应当依照本法第八十七条规定支付赔偿金。-法律依据：《劳动合同法》第四十八条用人单位违反本法规定解除或者终止劳动合同，劳动者要求继续履行劳动合同的，用人单位应当继续履行；劳动者不要求继续履行劳动合同或者劳动合同已经不能继续履行的，用人单位应当依照本法第八十七条规定支付赔偿金。,回答
问劳动争议申请仲裁的时效是多长时间,问题,专业回答,劳动争议申请仲裁的时效期间为一年。仲裁时效期间从当事人知道或者应当知道其权利被侵害之日起计算。因当事人一方向对方当事人主张权利，或者向有关部门请求权利救济，或者对方当事人同意履行义务而中断。从中断时起，仲裁时效期间重新计算。根据《劳动争议调解仲裁法》第二十七条第三款规定，因不可抗力或者有其他正当理由，当事人不能在本条第一款规定的仲裁时效期间申请仲裁的，仲裁时效中止。从中止时效的原因消除之日起，仲裁时效期间继续计算。-法律依据：《劳动争议调解仲裁法》第二十七条劳动争议申请仲裁的时效期间为一年。仲裁时效期间从当事人知道或者应当知道其权利被侵害之日起计算。前款规定的仲裁时效，因当事人一方向对方当事人主张权利，或者向有关部门请求权利救济，或者对方当事人同意履行义务而中断。从中断时起，仲裁时效期间重新计算。因不可抗力或者有其他正当理由，当事人不能在本条第一款规定的仲裁时效期间申请仲裁的，仲裁时效中止。从中止时效的原因消除之日起，仲裁时效期间继续计算。,回答
问劳动争议仲裁管辖法院怎么确定,问题,专业回答,发生劳动争议的，对仲裁结果不满意的，劳动争议案件由用人单位所在地或者劳动合同履行地的基层人民法院管辖。劳动合同履行地不明确的，由用人单位所在地的基层人民法院管辖。根据《劳动争议调解仲裁法》第五十条的规定，当事人对本法第四十七条规定以外的其他劳动争议案件的仲裁裁决不服的，可以自收到仲裁裁决书之日起十五日内向人民法院提起诉讼；期满不起诉的，裁决书发生法律效力。-法律依据：《劳动争议调解仲裁法》第五十条当事人对本法第四十七条规定以外的其他劳动争议案件的仲裁裁决不服的，可以自收到仲裁裁决书之日起十五日内向人民法院提起诉讼；期满不起诉的，裁决书发生法律效力。,回答
问劳动合同到期未通知续签合同如何赔偿,问题,专业回答,劳动合同到期不通知的，用人单位可以选择不续签合同并且不需要任何理由，但是应当支付经济补偿金。每满一年补偿一个月工资，不满半年补偿半个月工资，满半年不满一年补偿一个月工资。根据《劳动合同法》第四十八条规定，用人单位违反本法规定解除或者终止劳动合同，劳动者要求继续履行劳动合同的，用人单位应当继续履行；劳动者不要求继续履行劳动合同或者劳动合同已经不能继续履行的，用人单位应当依照本法第八十七条规定支付赔偿金。-法律依据：《劳动合同法》第四十八条用人单位违反本法规定解除或者终止劳动合同，劳动者要求继续履行劳动合同的，用人单位应当继续履行；劳动者不要求继续履行劳动合同或者劳动合同已经不能继续履行的，用人单位应当依照本法第八十七条规定支付赔偿金。,回答
问做出工伤认定对方不服怎么处理,问题,专业回答,劳动者或用人单位对工伤认定结论不服的，可以依法申请行政复议；对复议决定仍不服的，可以提起行政诉讼。申请工伤认定的职工或者直系亲属、该职工所在单位对工伤认定结论不服的，应该首先申请行政复议，对行政复议决定不服的，再依法提起行政诉讼。根据《工伤认定办法》第二十三条规定，职工或者其近亲属、用人单位对不予受理决定不服或者对工伤认定决定不服的，可以依法申请行政复议或者提起行政诉讼。-法律依据：《工伤认定办法》第二十三条职工或者其近亲属、用人单位对不予受理决定不服或者对工伤认定决定不服的，可以依法申请行政复议或者提起行政诉讼。,回答
问申请工伤认定书时效有限制吗,问题,专业回答,申请工伤认定是有时效限制的，职工发生事故伤害或者按照职业病防治法规定被诊断、鉴定为职业病，所在单位应当自事故伤害发生之日或者被诊断、鉴定为职业病之日起30日内，向统筹地区社会保险行政部门提出工伤认定申请。遇有特殊情况，经报社会保险行政部门同意，申请时限可以适当延长。根据《工伤保险条例》第十七条第二款规定，用人单位未按前款规定提出工伤认定申请的，工伤职工或者其近亲属、工会组织在事故伤害发生之日或者被诊断、鉴定为职业病之日起1年内，可以直接向用人单位所在地统筹地区社会保险行政部门提出工伤认定申请。-法律依据：《工伤保险条例》第十七条职工发生事故伤害或者按照职业病防治法规定被诊断、鉴定为职业病，所在单位应当自事故伤害发生之日或者被诊断、鉴定为职业病之日起30日内，向统筹地区社会保险行政部门提出工伤认定申请。遇有特殊情况，经报社会保险行政部门同意，申请时限可以适当延长。用人单位未按前款规定提出工伤认定申请的，工伤职工或者其近亲属、工会组织在事故伤害发生之日或者被诊断、鉴定为职业病之日起1年内，可以直接向用人单位所在地统筹地区社会保险行政部门提出工伤认定申请。按照本条第一款规定应当由省级社会保险行政部门进行工伤认定的事项，根据属地原则由用人单位所在地的设区的市级社会保险行政部门办理。,回答
问劳动法规定过年放假期间有没有工资,问题,专业回答,按照劳动法规定，春节放假期间，工资照发。节假日和调休都是工资照发，节假日加班按三倍工资计算，调休的假期按两倍工资计算。春节属于国家法定的节假日，农历正月初一至初三为法定节假日。根据《劳动法》第四十四条规定，有下列情形之一的，用人单位应当按照下列标准支付高于劳动者正常工作时间工资的工资报酬：（一）安排劳动者延长工作时间的，支付不低于工资的百分之一百五十的工资报酬；（二）休息日安排劳动者工作又不能安排补休的，支付不低于工资的百分之二百的工资报酬；（三）法定休假日安排劳动者工作的，支付不低于工资的百分之三百的。-法律依据：《劳动法》第四十四条有下列情形之一的，用人单位应当按照下列标准支付高于劳动者正常工作时间工资的工资报酬：（一）安排劳动者延长工作时间的，支付不低于工资的百分之一百五十的工资报酬；（二）休息日安排劳动者工作又不能安排补休的，支付不低于工资的百分之二百的工资报酬；（三）法定休假日安排劳动者工作的，支付不低于工资的百分之三百的。,回答
问员工被批捕后能否解除劳动合同,问题,专业回答,员工被批捕后，应当负刑事责任的，用人单位可以解除劳动合同。根据《劳动合同法》第三十九条规定，劳动者有下列情形之一的，用人单位可以解除劳动合同：（一）在试用期间被证明不符合录用条件的；（二）严重违反用人单位的规章制度的；（三）严重失职，营私舞弊，给用人单位造成重大损害的；（四）劳动者同时与其他用人单位建立劳动关系，对完成本单位的工作任务造成严重影响，或者经用人单位提出，拒不改正的；（五）因本法第二十六条第一款第一项规定的情形致使劳动合同无效的；（六）被依法追究刑事责任的。-法律依据：《劳动合同法》第三十九条劳动者有下列情形之一的，用人单位可以解除劳动合同：（一）在试用期间被证明不符合录用条件的；（二）严重违反用人单位的规章制度的；（三）严重失职，营私舞弊，给用人单位造成重大损害的；（四）劳动者同时与其他用人单位建立劳动关系，对完成本单位的工作任务造成严重影响，或者经用人单位提出，拒不改正的；（五）因本法第二十六条第一款第一项规定的情形致使劳动合同无效的；（六）被依法追究刑事责任的。,回答
问在试用期被开除有补偿吗,问题,专业回答,如果用人单位在试用期是合法解除劳动合同是不需要支付补偿金的，只有违反《劳动合同法》的相关规定的情况，用人单位才需要支付补偿金。用人单位没有实质性的原因就随意开除试用期员工，需要向劳动者支付补偿金。根据《劳动合同法》第四十七条第一款规定，经济补偿按劳动者在本单位工作的年限，每满一年支付一个月工资的标准向劳动者支付。六个月以上不满一年的，按一年计算；不满六个月的，向劳动者支付半个月工资的经济补偿。-法律依据：中华人民共和国劳动合同法第四十七条经济补偿按劳动者在本单位工作的年限，每满一年支付一个月工资的标准向劳动者支付。六个月以上不满一年的，按一年计算；不满六个月的，向劳动者支付半个月工资的经济补偿。劳动者月工资高于用人单位所在直辖市、设区的市级人民政府公布的本地区上年度职工月平均工资三倍的，向其支付经济补偿的标准按职工月平均工资三倍的数额支付，向其支付经济补偿的年限最高不超过十二年。本条所称月工资是指劳动者在劳动合同解除或者终止前十二个月的平均工资。,回答
问劳动合同期内辞职有补偿吗,问题,专业回答,劳动合同期内，劳动者主动辞职的，是没有补偿金的。用人单位无正当理由单方提前解除劳动合同的，劳动者才可以获得经济补偿金，劳动者单方提前辞职是不能获得经济补偿金的。若用人单位违法解除劳动合同的，应当支付劳动者的劳动报酬和经济补偿，并应支付赔偿金。根据《劳动合同法》第八十七条规定，用人单位违反本法规定解除或者终止劳动合同的，应当依照本法第四十七条规定的经济补偿标准的二倍向劳动者支付赔偿金。-法律依据：《劳动合同法》第八十七条用人单位违反本法规定解除或者终止劳动合同的，应当依照本法第四十七条规定的经济补偿标准的二倍向劳动者支付赔偿金。,回答
问单位不开解除劳动合同怎么办,问题,专业回答,单位不开解除劳动合同证明的，劳动者可以反映到劳动局、仲裁委员会处理，造成劳动者损失的，可以要求公司赔偿。用人单位应当在解除或者终止劳动合同时出具解除或者终止劳动合同的证明。根据《劳动合同法》第五十条规定，用人单位应当在解除或者终止劳动合同时出具解除或者终止劳动合同的证明，并在十五日内为劳动者办理档案和社会保险关系转移手续。劳动者应当按照双方约定，办理工作交接。用人单位依照本法有关规定应当向劳动者支付经济补偿的，在办结工作交接时支付。用人单位对已经解除或者终止的劳动合同的文本，至少保存二年备查。-法律依据：《劳动合同法》第五十条用人单位应当在解除或者终止劳动合同时出具解除或者终止劳动合同的证明，并在十五日内为劳动者办理档案和社会保险关系转移手续。劳动者应当按照双方约定，办理工作交接。用人单位依照本法有关规定应当向劳动者支付经济补偿的，在办结工作交接时支付。用人单位对已经解除或者终止的劳动合同的文本，至少保存二年备查。,回答
问劳动仲裁当中谁有举证责任,问题,专业回答,劳动仲裁中，用人单位和劳动者都有举证责任。发生劳动争议，当事人对自己提出的主张，有责任提供证据。但是，与争议事项有关的证据属于用人单位掌握管理的，用人单位应当提供。根据《劳动争议调解仲裁法》第三条规定，解决劳动争议，应当根据事实，遵循合法、公正、及时、着重调解的原则，依法保护当事人的合法权益。第四条规定，发生劳动争议，劳动者可以与用人单位协商，也可以请工会或者第三方共同与用人单位协商，达成和解协议。-法律依据：《劳动争议调解仲裁法》第三条解决劳动争议，应当根据事实，遵循合法、公正、及时、着重调解的原则，依法保护当事人的合法权益。《劳动争议调解仲裁法》第四条发生劳动争议，劳动者可以与用人单位协商，也可以请工会或者第三方共同与用人单位协商，达成和解协议。,回答
问工地工人误工费没有固定收入的怎么办,问题,专业回答,工地工人的误工费，没有固定收入的，可以按照其最近三年的平均收入计算。受害人不能举证证明其最近三年的平均收入状况的，可以参照受诉法院所在地相同或者相近行业上一年度职工的平均工资计算。根据《最高人民法院关于审理人身损害赔偿案件适用法律若干问题的解释》第七条第一、二款规定，误工费根据受害人的误工时间和收入状况确定。误工时间根据受害人接受治疗的医疗机构出具的证明确定。受害人因伤致残持续误工的，误工时间可以计算至定残日前一天。-法律依据：《最高人民法院关于审理人身损害赔偿案件适用法律若干问题的解释》第七条误工费根据受害人的误工时间和收入状况确定。误工时间根据受害人接受治疗的医疗机构出具的证明确定。受害人因伤致残持续误工的，误工时间可以计算至定残日前一天。受害人有固定收入的，误工费按照实际减少的收入计算。受害人无固定收入的，按照其最近三年的平均收入计算；受害人不能举证证明其最近三年的平均收入状况的，可以参照受诉法院所在地相同或者相近行业上一年度职工的平均工资计算。,回答
问被单位解除劳动合同已签字怎么办,问题,专业回答,被单位解除劳动合同已签字的，劳动合同生效。单位无故解除劳动合同的，需要支付经济补偿金给员工。如果拒绝支付的，可以申请劳动仲裁或者向劳动监察部门投诉单位的违法行为。根据《劳动合同法》第三十六条规定，用人单位与劳动者协商一致，可以解除劳动合同。第三十七条规定，劳动者提前三十日以书面形式通知用人单位，可以解除劳动合同。劳动者在试用期内提前三日通知用人单位，可以解除劳动合同。-法律依据：《劳动合同法》第三十六条用人单位与劳动者协商一致，可以解除劳动合同。《劳动合同法》第三十七条劳动者提前三十日以书面形式通知用人单位，可以解除劳动合同。劳动者在试用期内提前三日通知用人单位，可以解除劳动合同。,回答
问公司降薪劳动合同有效吗,问题,专业回答,公司降薪后需要重新签订劳动合同。在降职降薪之后，原本的劳动合同的基本内容改变了，是需要变更劳动合同的。劳动合同的变更需要根据规定，由公司和劳动者协商一致，对原合同的部分内容进行修改，变更后的合同与原合同具有同等法律效力。根据《劳动合同法》第三十五条规定，用人单位与劳动者协商一致，可以变更劳动合同约定的内容。变更劳动合同，应当采用书面形式。变更后的劳动合同文本由用人单位和劳动者各执一份。-法律依据：中华人民共和国劳动合同法第三十五条用人单位与劳动者协商一致，可以变更劳动合同约定的内容。变更劳动合同，应当采用书面形式。变更后的劳动合同文本由用人单位和劳动者各执一份。,回答
问公司劳动合同遗失可以补签吗,问题,专业回答,公司劳动合同遗失的，可以补签。劳动者与用人单位签订的劳动合同，属于劳动者的那一份劳动合同丢失，劳动者可以让公司补办。一般一式三份，由劳动者本人、用人单位和劳动部门各保存一份。根据《劳动合同法》第十条规定，建立劳动关系，应当订立书面劳动合同。已建立劳动关系，未同时订立书面劳动合同的，应当自用工之日起一个月内订立书面劳动合同。用人单位与劳动者在用工前订立劳动合同的，劳动关系自用工之日起建立。-法律依据：《劳动合同法》第十条建立劳动关系，应当订立书面劳动合同。已建立劳动关系，未同时订立书面劳动合同的，应当自用工之日起一个月内订立书面劳动合同。用人单位与劳动者在用工前订立劳动合同的，劳动关系自用工之日起建立。,回答
问什么情形下单位要支付员工补偿金,问题,专业回答,符合下列情形的，用人单位应当向劳动者支付经济补偿：1、未按照劳动合同约定提供劳动保护或者劳动条件的；2、未及时足额支付劳动报酬的；3、未依法为劳动者缴纳社会保险费的；4、用人单位的规章制度违反法律、法规的规定，损害劳动者权益的。根据《劳动合同法》第四十七条第一款规定，经济补偿按劳动者在本单位工作的年限，每满一年支付一个月工资的标准向劳动者支付。六个月以上不满一年的，按一年计算；不满六个月的，向劳动者支付半个月工资的经济补偿。-法律依据：《劳动合同法》第四十七条经济补偿按劳动者在本单位工作的年限，每满一年支付一个月工资的标准向劳动者支付。六个月以上不满一年的，按一年计算；不满六个月的，向劳动者支付半个月工资的经济补偿。劳动者月工资高于用人单位所在直辖市、设区的市级人民政府公布的本地区上年度职工月平均工资三倍的，向其支付经济补偿的标准按职工月平均工资三倍的数额支付，向其支付经济补偿的年限最高不超过十二年。本条所称月工资是指劳动者在劳动合同解除或者终止前十二个月的平均工资。,回答
