question,question_tag,property,answer,answer_tag
问劳动合同超过一个月没有签订怎么去处理,问题,专业回答,劳动合同超过一个月没有签订的，用人单位应当向劳动者每月支付二倍的工资，劳动者自己拒绝签订劳动合同的除外依据《劳动合同法》第八十二条规定，用人单位自用工之日起超过一个月不满一年未与劳动者订立书面劳动合同的，应当向劳动者每月支付二倍的工资。第十四条第三款规定，用人单位自用工之日起满一年不与劳动者订立书面劳动合同的，视为用人单位与劳动者已订立无固定期限劳动合同。-法律依据：《中华人民共和国劳动合同法》第八十二条,回答
问口头解除劳动合同怎么去进行,问题,专业回答,口头解除劳动合同，能够直接和上司或者公司有关部门提出。依据《劳动合同法》第三十八条第一款规定，用人单位有下列情形之一的，劳动者能够解除劳动合同：（一）未按照劳动合同约定提供劳动保护或者劳动条件的；（二）未及时足额支付劳动报酬的；（三）未依法为劳动者缴纳社会保险费的；（四）用人单位的规章制度违反法律、法规的规定，损害劳动者权益的；（五）因本法第二十六条第一款规定的情形致使劳动合同无效的；（六）法律、行政法规规定劳动者能够解除劳动合同的其他情形。-法律依据：《中华人民共和国劳动合同法》第三十八条,回答
问单位欠薪怎么去解除合同,问题,专业回答,单位欠薪劳动者能够通知单位解除劳动合同，并且能够要求用人单位支付支付工资和经济补偿。《劳动合同法》第三十八条规定，用人单位有下列情形之一的，劳动者能够解除劳动合同：（一）未按照劳动合同约定提供劳动保护或者劳动条件的；（二）未及时足额支付劳动报酬的；（三）未依法为劳动者缴纳社会保险费的；（四）用人单位的规章制度违反法律、法规的规定，损害劳动者权益的；（五）因本法第二十六条第一款规定的情形致使劳动合同无效的；（六）法律、行政法规规定劳动者能够解除劳动合同的其他情形。-法律依据：《中华人民共和国劳动合同法》第四十六条,回答
问公司能够强迫员工做直播吗,问题,专业回答,公司不能够强迫员工做直播。《劳动合同法》第三十六条规定，用人单位与劳动者协商一致，能够解除劳动合同。第三十七条规定，劳动者提前三十日以书面形式通知用人单位，能够解除劳动合同。劳动者在试用期内提前三日通知用人单位，能够解除劳动合同。第三十八条第二款规定，用人单位以暴力、威胁或者非法限制人身自由的手段强迫劳动者劳动的，或者用人单位违章指挥、强令冒险作业危及劳动者人身安全的，劳动者能够立即解除劳动合同，不需事先告知用人单位。-法律依据：《中华人民共和国劳动合同法》第三十六条,回答
问什么情况可终止劳动合同,问题,专业回答,依据《中华人民共和国劳动合同法》第四十四条规定，有下列情形之一的，劳动合同终止：（一）劳动合同期满的；（二）劳动者开始依法享受基本养老保险待遇的；（三）劳动者死亡，或者被人民法院宣告死亡或者宣告失踪的；（四）用人单位被依法宣告破产的；（五）用人单位被吊销营业执照、责令关闭、撤销或者用人单位决定提前解散的；（六）法律、行政法规规定的其他情形。第四十五条规定，劳动合同期满，有本法第四十二条规定情形之一的，劳动合同应当续延至相应的情形消失时终止。但是，本法第四十二条第二项规定丧失或者部分丧失劳动能力劳动者的劳动合同的终止，按照国家有关工伤保险的规定执行。-法律依据：《中华人民共和国劳动合同法》第四十四条,回答
问不得解除劳动合同情形有哪些,问题,专业回答,依据《中华人民共和国劳动合同法》第四十二条规定，依照本法第四十条、第四十一条的规定解除劳动合同的情形包括：（一）从事接触职业病危害作业的劳动者未进行离岗前职业健康检查，或者疑似职业病病人在诊断或者医学观察期间的；（二）在本单位患职业病或者因工负伤并被确认丧失或者部分丧失劳动能力的；（三）患病或者非因工负伤，在规定的医疗期内的；（四）女职工在孕期、产期、哺乳期的；（五）在本单位连续工作满十五年，且距法定退休年龄不足五年的；（六）法律、行政法规规定的其他情形。-法律依据：《中华人民共和国劳动合同法》第四十二条,回答
问劳动者单方解除劳动合同的情形有什么,问题,专业回答,依据《劳动合同法》第三十八条规定，劳动者单方解除劳动合同的情形包括：1.未按照劳动合同约定提供劳动保护或者劳动条件的；2.未及时足额支付劳动报酬的；3.未依法为劳动者缴纳社会保险费的；4.用人单位的规章制度违反法律、法规的规定，损害劳动者权益的；5.因本法第二十六条第一款规定的情形致使劳动合同无效的；6.法律、行政法规规定劳动者能够解除劳动合同的其他情形。用人单位以暴力、威胁或者非法限制人身自由的手段强迫劳动者劳动的，或者用人单位违章指挥、强令冒险作业危及劳动者人身安全的，劳动者能够立即解除劳动合同，不需事先告知用人单位。-法律依据：《中华人民共和国劳动合同法》第三十八条,回答
问与公司解除劳动合同需要哪些手续,问题,专业回答,与公司解除劳动合同需要下列手续如下：1、通知用人单位解除劳动合同，如递交《劳动关系解除通知书》；2、办离职交接手续并要求出具解除劳动合同证明、结清工资和经济补偿金。《劳动合同法》第五十条规定，用人单位应当在解除或者终止劳动合同时出具解除或者终止劳动合同的证明，并在十五日内为劳动者办理档案和社会保险关系转移手续。劳动者应当按照双方约定，办理工作交接。用人单位依照本法有关规定应当向劳动者支付经济补偿的，在办结工作交接时支付。用人单位对已经解除或者终止的劳动合同的文本，至少保存二年备查。-法律依据：《中华人民共和国劳动合同法》第五十条,回答
问签订两次劳动合同后一定要续签吗,问题,专业回答,签订两次劳动合同后不是必须续签。《劳动合同法》第十四条规定第二、三款规定，用人单位与劳动者协商一致，能够订立无固定期限劳动合同。有下列情形之一，劳动者提出或者同意续订、订立劳动合同的，除劳动者提出订立固定期限劳动合同外，应当订立无固定期限劳动合同：（一）劳动者在该用人单位连续工作满十年的；（二）用人单位初次实行劳动合同制度或者国有企业改制重新订立劳动合同时，劳动者在该用人单位连续工作满十年且距法定退休年龄不足十年的；（三）连续订立二次固定期限劳动合同，且劳动者没有本法第三十九条和第四十条第一项、第二项规定的情形，续订劳动合同的。用人单位自用工之日起满一年不与劳动者订立书面劳动合同的，视为用人单位与劳动者已订立无固定期限劳动合同。-法律依据：《中华人民共和国劳动合同法》第十四条,回答
问提前一个月辞职是否有年终奖,问题,专业回答,提前一个月辞职有年终奖。《劳动合同法》第三十七条规定，劳动者提前三十日以书面形式通知用人单位，能够解除劳动合同。劳动者在试用期内提前三日通知用人单位，能够解除劳动合同。第三十八条第二款规定，用人单位以暴力、威胁或者非法限制人身自由的手段强迫劳动者劳动的，或者用人单位违章指挥、强令冒险作业危及劳动者人身安全的，劳动者能够立即解除劳动合同，不需事先告知用人单位。-法律依据：《中华人民共和国劳动合同法》第三十六条,回答
问哺乳期辞退员工能够吗,问题,专业回答,依据《中华人民共和国劳动合同法》第三十九条规定，哺乳期的劳动者有下列情形之一的，用人单位能够辞退，否则不能辞退：（一）在试用期间被证明不符合录用条件的；（二）严重违反用人单位的规章制度的；（三）严重失职，营私舞弊，给用人单位造成重大损害的；（四）劳动者同时与其他用人单位建立劳动关系，对完成本单位的工作任务造成严重影响，或者经用人单位提出，拒不改正的；（五）因本法第二十六条第一款第一项规定的情形致使劳动合同无效的；（六）被依法追究刑事责任的。-法律依据：《中华人民共和国劳动合同法》第三十九条,回答
问员工已经同意调岗可以反悔吗,问题,专业回答,员工已经同意调岗后又反悔的，只要与用人单位协商一致，能够继续从事原来岗位。《劳动合同法》第三十五条规定，用人单位与劳动者协商一致，能够变更劳动合同约定的内容。变更劳动合同，应当采用书面形式。变更后的劳动合同文本由用人单位和劳动者各执一份。第四十条规定，劳动合同订立时所依据的客观情况发生重大变化，致使劳动合同无法履行，经用人单位与劳动者协商，未能就变更劳动合同内容达成协议的，用人单位提前三十日以书面形式通知劳动者本人或者额外支付劳动者一个月工资后，能够解除劳动合同。-法律依据：《中华人民共和国劳动合同法》第二十九条,回答
问劳动法中劳动关系成立有什么条件,问题,专业回答,劳动法中劳动关系成立的条件如下：1、用人单位和劳动者符合法律、法规规定的主体资格；2、用人单位和劳动者签订劳动合同的意思表示真实；3、不存在违反法律、行政法规强制性规定以及违反公序良俗的情形；4、符合劳动合同法规定的形式要件。《劳动合同法》第十条规定，建立劳动关系，应当订立书面劳动合同。已建立劳动关系，未同时订立书面劳动合同的，应当自用工之日起一个月内订立书面劳动合同。用人单位与劳动者在用工前订立劳动合同的，劳动关系自用工之日起建立。第十六条规定，劳动合同由用人单位与劳动者协商一致，并经用人单位与劳动者在劳动合同文本上签字或者盖章生效。劳动合同文本由用人单位和劳动者各执一份。-法律依据：《中华人民共和国劳动合同法》第十条,回答
问没有书面通知的调岗合法吗,问题,专业回答,没有书面通知的调岗不合法。《劳动合同法》第三十五条规定，用人单位与劳动者协商一致，能够变更劳动合同约定的内容。变更劳动合同，应当采用书面形式。变更后的劳动合同文本由用人单位和劳动者各执一份。第四十条规定，劳动合同订立时所依据的客观情况发生重大变化，致使劳动合同无法履行，经用人单位与劳动者协商，未能就变更劳动合同内容达成协议的，用人单位提前三十日以书面形式通知劳动者本人或者额外支付劳动者一个月工资后，能够解除劳动合同。-法律依据：《中华人民共和国劳动合同法》第二十九条,回答
问劳动合同到期自动顺延属于续签吗,问题,专业回答,劳动合同到期自动顺延不是续签。自动顺延是因法定情形而发生的，续签是劳动者与用人单位达成了续签合意而形成的。《中华人民共和国劳动合同法》第四十五条规定，劳动合同期满，有本法第四十二条规定情形之一的，劳动合同应当续延至相应的情形消失时终止。但是，本法第四十二条第二项规定丧失或者部分丧失劳动能力劳动者的劳动合同的终止，按照国家有关工伤保险的规定执行。第四十二条规定，劳动者有下列情形之一的，用人单位不得依照本法第四十条、第四十一条的规定解除劳动合同：（一）从事接触职业病危害作业的劳动者未进行离岗前职业健康检查，或者疑似职业病病人在诊断或者医学观察期间的；（二）在本单位患职业病或者因工负伤并被确认丧失或者部分丧失劳动能力的；（三）患病或者非因工负伤，在规定的医疗期内的；（四）女职工在孕期、产期、哺乳期的。-法律依据：《中华人民共和国劳动合同法》第四十五条,回答
问在试用期能够解除合同吗,问题,专业回答,在试用期能够解除合同。《劳动合同法》第三十九条规定，劳动者有下列情形之一的，用人单位能够解除劳动合同：（一）在试用期间被证明不符合录用条件的；（二）严重违反用人单位的规章制度的；（三）严重失职，营私舞弊，给用人单位造成重大损害的；（四）劳动者同时与其他用人单位建立劳动关系，对完成本单位的工作任务造成严重影响，或者经用人单位提出，拒不改正的；（五）因本法第二十六条第一款第一项规定的情形致使劳动合同无效的；（六）被依法追究刑事责任的。-法律依据：《中华人民共和国劳动合同法》第三十九条,回答
问劳动合同续签怎么走程序,问题,专业回答,劳动合同续签的程序如下：1、进行综合评估后决定是否续签；2、提前30天向劳动者发出续签劳动合同通知书；3、自收到通知之日起7日内书面答复；4、协商具体事项，重新协商签订新的劳动合同。《劳动合同法》第四十六条规定，除用人单位维持或者提高劳动合同约定条件续订劳动合同，劳动者不同意续订的情形外，依照本法第四十四条第一项规定终止固定期限劳动合同的，用人单位应当向劳动者支付经济补偿。第四十七条第一款规定，经济补偿按劳动者在本单位工作的年限，每满一年支付一个月工资的标准向劳动者支付。六个月以上不满一年的，按一年计算；不满六个月的，向劳动者支付半个月工资的经济补偿。-法律依据：《中华人民共和国劳动合同法》第四十六条,回答
问无期限合同工能够辞退吗,问题,专业回答,无期限合同工能够辞退。《中华人民共和国劳动合同法》第三十九条规定，劳动者有下列情形之一的，用人单位能够解除劳动合同：（一）在试用期间被证明不符合录用条件的；（二）严重违反用人单位的规章制度的；（三）严重失职，营私舞弊，给用人单位造成重大损害的；（四）劳动者同时与其他用人单位建立劳动关系，对完成本单位的工作任务造成严重影响，或者经用人单位提出，拒不改正的；（五）因本法第二十六条第一款第一项规定的情形致使劳动合同无效的；（六）被依法追究刑事责任的。-法律依据：《中华人民共和国劳动合同法》第三十九条,回答
问企业用工超时如何取证,问题,专业回答,企业用工超时的取证，主要在于当事人即时保存能够证明自己主张的书证、物证、视听资料、电子数据。有证人的，证人证言能够作为证据。《中华人民共和国劳动争议调解仲裁法》第六条规定，发生劳动争议，当事人对自己提出的主张，有责任提供证据。与争议事项有关的证据属于用人单位掌握管理的，用人单位应当提供；用人单位不提供的，应当承担不利后果。第三十九条规定，当事人提供的证据经查证属实的，仲裁庭应当将其作为认定事实的根据。劳动者无法提供由用人单位掌握管理的与仲裁请求有关的证据，仲裁庭能够要求用人单位在指定期限内提供。用人单位在指定期限内不提供的，应当承担不利后果。-法律依据：《中华人民共和国劳动争议调解仲裁法》第六条,回答
问无效劳动合同如何处理,问题,专业回答,无效劳动合同的处理办法：劳动合同被确认无效，劳动者已付出劳动的，用人单位应当向劳动者支付劳动报酬。劳动报酬的数额，参照本单位相同或者相近岗位劳动者的劳动报酬确定。《劳动合同法》第二十六条规定，下列劳动合同无效或者部分无效：（一）以欺诈、胁迫的手段或者乘人之危，使对方在违背真实意思的情况下订立或者变更劳动合同的；（二）用人单位免除自己的法定责任、排除劳动者权利的；（三）违反法律、行政法规强制性规定的。对劳动合同的无效或者部分无效有争议的，由劳动争议仲裁机构或者人民法院确认。-法律依据：《中华人民共和国劳动合同法》第二十六条,回答
问违法解除劳动合同可以恢复吗,问题,专业回答,违法解除的劳动合同，劳动者能够要求恢复劳动关系。《中华人民共和国劳动合同法》第四十八条规定，用人单位违反本法规定解除或者终止劳动合同，劳动者要求继续履行劳动合同的，用人单位应当继续履行；劳动者不要求继续履行劳动合同或者劳动合同已经不能继续履行的，用人单位应当依照本法第八十七条规定支付赔偿金。第八十七条规定，用人单位违反本法规定解除或者终止劳动合同的，应当依照本法第四十七条规定的经济补偿标准的二倍向劳动者支付赔偿金。-法律依据：《中华人民共和国劳动合同法》第四十八条,回答
问员工口头辞职有法律效力吗,问题,专业回答,员工口头辞职，用人单位接受的有效，否则需要书面通知用人单位或者存在法定单方解除事由。《劳动合同法》第三十六条规定，用人单位与劳动者协商一致，能够解除劳动合同。第三十七条规定，劳动者提前三十日以书面形式通知用人单位，能够解除劳动合同。劳动者在试用期内提前三日通知用人单位，能够解除劳动合同。第三十八条第二款规定，用人单位以暴力、威胁或者非法限制人身自由的手段强迫劳动者劳动的，或者用人单位违章指挥、强令冒险作业危及劳动者人身安全的，劳动者能够立即解除劳动合同，不需事先告知用人单位。-法律依据：《中华人民共和国劳动合同法》第三十六条,回答
问劳动合同终止如何解除,问题,专业回答,劳动合同终止只要符合劳动合同的终止条件就能够终止。劳动合同的解除有三种主要方式：1、劳动者与用人单位协商解除；2、劳动者依法单方解除劳动合同；3、用人单位依法单方解除劳动合同。《中华人民共和国劳动合同法》第四十四条规定，有下列情形之一的，劳动合同终止：（一）劳动合同期满的；（二）劳动者开始依法享受基本养老保险待遇的；（三）劳动者死亡，或者被人民法院宣告死亡或者宣告失踪的；（四）用人单位被依法宣告破产的；（五）用人单位被吊销营业执照、责令关闭、撤销或者用人单位决定提前解散的；（六）法律、行政法规规定的其他情形。-法律依据：《中华人民共和国劳动合同法》第四十四条,回答
问期满公司不续签有经济补偿吗,问题,专业回答,劳动合同期满公司不续签有经济补偿。《劳动合同法》第四十六条规定，除用人单位维持或者提高劳动合同约定条件续订劳动合同，劳动者不同意续订的情形外，依照本法第四十四条第一项规定终止固定期限劳动合同的，用人单位应当向劳动者支付经济补偿。第四十七条第一款规定，经济补偿按劳动者在本单位工作的年限，每满一年支付一个月工资的标准向劳动者支付。六个月以上不满一年的，按一年计算；不满六个月的，向劳动者支付半个月工资的经济补偿。-法律依据：《中华人民共和国劳动合同法》第四十六条,回答
问暑期工能够随时辞职吗,问题,专业回答,暑期能够按规定向用人单位提出辞职。《劳动合同法》第三十七条规定，劳动者提前三十日以书面形式通知用人单位，能够解除劳动合同。劳动者在试用期内提前三日通知用人单位，能够解除劳动合同。第三十八条第二款规定，用人单位以暴力、威胁或者非法限制人身自由的手段强迫劳动者劳动的，或者用人单位违章指挥、强令冒险作业危及劳动者人身安全的，劳动者能够立即解除劳动合同，不需事先告知用人单位。-法律依据：《中华人民共和国劳动合同法》第三十六条,回答
问试用期公司可以解除劳动合同么,问题,专业回答,试用期公司能解除劳动合同。《劳动合同法》第三十九条规定，劳动者有下列情形之一的，用人单位能够解除劳动合同：（一）在试用期间被证明不符合录用条件的；（二）严重违反用人单位的规章制度的；（三）严重失职，营私舞弊，给用人单位造成重大损害的；（四）劳动者同时与其他用人单位建立劳动关系，对完成本单位的工作任务造成严重影响，或者经用人单位提出，拒不改正的；（五）因本法第二十六条第一款第一项规定的情形致使劳动合同无效的；（六）被依法追究刑事责任的。-法律依据：《中华人民共和国劳动合同法》第三十九条,回答
问员工拒绝补签劳动合同怎么规定,问题,专业回答,员工拒绝补签劳动合同，用人单位能够继续双倍付薪，或者终止合同。《劳动合同法》第八十二条规定，用人单位自用工之日起超过一个月不满一年未与劳动者订立书面劳动合同的，应当向劳动者每月支付二倍的工资。用人单位违反本法规定不与劳动者订立无固定期限劳动合同的，自应当订立无固定期限劳动合同之日起向劳动者每月支付二倍的工资。第十条规定，建立劳动关系，应当订立书面劳动合同。已建立劳动关系，未同时订立书面劳动合同的，应当自用工之日起一个月内订立书面劳动合同。用人单位与劳动者在用工前订立劳动合同的，劳动关系自用工之日起建立。-法律依据：《中华人民共和国劳动合同法》第八十二条,回答
问法定假日拒绝上班构成旷工吗,问题,专业回答,法定假日拒绝加班不算旷工。《劳动法》第四十一条规定，用人单位由于生产经营需要，经与工会和劳动者协商后能够延长工作时间，一般每日不得超过一小时；因特殊原因需要延长工作时间的，在保障劳动者身体健康的条件下延长工作时间每日不得超过三小时，但是每月不得超过三十六小时。《劳动合同法》第三十一条规定，用人单位应当严格执行劳动定额标准，不得强迫或者变相强迫劳动者加班。用人单位安排加班的，应当按照国家有关规定向劳动者支付加班费。-法律依据：《中华人民共和国劳动法》第四十一条,回答
问辞职单位不批如何办,问题,专业回答,辞职单位不批，劳动者只需要提前30天通知用人单位解除劳动合同即可，30天后如果用人单位不为劳动者办理离职手续的，不发给解除劳动合同证明的，劳动者能够申请劳动仲裁。《劳动合同法》第三十七条规定，劳动者提前三十日以书面形式通知用人单位，能够解除劳动合同。劳动者在试用期内提前三日通知用人单位，能够解除劳动合同。第三十八条第二款规定，用人单位以暴力、威胁或者非法限制人身自由的手段强迫劳动者劳动的，或者用人单位违章指挥、强令冒险作业危及劳动者人身安全的，劳动者能够立即解除劳动合同，不需事先告知用人单位。-法律依据：《中华人民共和国劳动合同法》第三十六条,回答
问想离职单位不批如何办,问题,专业回答,想离职单位不批，劳动者能够提前30天通知单位解除劳动合同。《劳动合同法》第三十七条规定，劳动者提前三十日以书面形式通知用人单位，能够解除劳动合同。劳动者在试用期内提前三日通知用人单位，能够解除劳动合同。第三十八条第二款规定，用人单位以暴力、威胁或者非法限制人身自由的手段强迫劳动者劳动的，或者用人单位违章指挥、强令冒险作业危及劳动者人身安全的，劳动者能够立即解除劳动合同，不需事先告知用人单位。-法律依据：《中华人民共和国劳动合同法》第三十七条,回答
