question,question_tag,property,model,model_tag
问有限责任公司发行股票投资人能否自己认购,问题,包含,公司,模块
问股东转让股权款是否要经过公司,问题,包含,公司,模块
问破产债权清偿顺位第一的是谁,问题,包含,公司,模块
问股东决议对哪些人有效的,问题,包含,公司,模块
问个人申请破产后需要还债吗,问题,包含,公司,模块
问公司清算有哪些要求,问题,包含,公司,模块
问实际出资人怎么变更为股东,问题,包含,公司,模块
问分公司倒闭想辞退员工怎么赔偿,问题,包含,公司,模块
问合伙合同协议书是否有效,问题,包含,公司,模块
问有限合伙人的权利有哪些,问题,包含,公司,模块
问董监高的忠实义务包括哪些内容,问题,包含,公司,模块
问一人有限责任公司变更经营范围怎么办理,问题,包含,公司,模块
问公司倒闭无期限合同职工怎么赔偿,问题,包含,公司,模块
问挂名股东享有股权吗,问题,包含,公司,模块
问股份有限公司设立方式有哪几种,问题,包含,公司,模块
问有限公司出资对外转让有哪些限制,问题,包含,公司,模块
问公司进行股份私募发行需要走哪些流程,问题,包含,公司,模块
问公司上市要符合的条件有什么,问题,包含,公司,模块
问所有的公司都有法人代表吗,问题,包含,公司,模块
问有限责任公司股东的主要权利包括哪些,问题,包含,公司,模块
问公司法监事任期是多长时间,问题,包含,公司,模块
问股东集体决定用款是否构成挪用资金,问题,包含,公司,模块
问公司并购确认股权收购价格应该如何确定,问题,包含,公司,模块
问国有股权转让挂牌需要提交哪些文件,问题,包含,公司,模块
问公司对股东债务承担连带责任吗,问题,包含,公司,模块
问企业实施末位淘汰制违法吗,问题,包含,公司,模块
问筹备中的公司的责任由谁承担,问题,包含,公司,模块
问设立证券公司需要哪些条件,问题,包含,公司,模块
问公司发起人出资义务的承担连带责任,问题,包含,公司,模块
问隐名股东出资义务未履行时，公司能否追讨,问题,包含,公司,模块
问有限公司法人变更需要什么手续,问题,包含,公司,模块
问金融公司需要承担哪些义务,问题,包含,公司,模块
问企业注册地和实际办公地不在一起违法吗,问题,包含,公司,模块
问公司法解散的规定内容包括什么,问题,包含,公司,模块
问公司解散需要股东会决议吗,问题,包含,公司,模块
问公司名称的有效期一般为多长时间,问题,包含,公司,模块
问股东能否委托他人代为行使查阅权,问题,包含,公司,模块
问企业法人破产还债程序的适用范围有哪些,问题,包含,公司,模块
问没上市的公司可以转让股权吗,问题,包含,公司,模块
问公司成立需要满足什么条件,问题,包含,公司,模块
问有限责任公司对于人数有要求吗,问题,包含,公司,模块
问公司兼并遵从什么程序,问题,包含,公司,模块
问破产企业整顿的程序是怎么样的,问题,包含,公司,模块
问股东会决议有效期是多久,问题,包含,公司,模块
问设立子公司需要哪些条件,问题,包含,公司,模块
问公司解散后员工怎么办,问题,包含,公司,模块
问企业非破产清算顺序是什么,问题,包含,公司,模块
问设立个人独资企业应该具备哪些法定条件,问题,包含,公司,模块
问公司出现哪些情形适用于吊销,问题,包含,公司,模块
问中小股东如何保护自己的利益,问题,包含,公司,模块
问合伙人退伙后是否承担债务,问题,包含,公司,模块
问母公司股东可以查阅子公司资料吗,问题,包含,公司,模块
问如何确认股东资格的管辖法院,问题,包含,公司,模块
问股东委托代理人参加临时股东会是否合法,问题,包含,公司,模块
问隐名股东投资协议签订是否具有法律依据,问题,包含,公司,模块
问一人公司与股东财产混同怎么办,问题,包含,公司,模块
问股东名册应当记载的事项有哪些,问题,包含,公司,模块
问公司股东分红权有哪些形式,问题,包含,公司,模块
问股权转让纠纷的诉讼当事人怎么确定,问题,包含,公司,模块
问公司法人有年龄限制吗,问题,包含,公司,模块
问股东大会的发起人是谁,问题,包含,公司,模块
问公司股东出资的规定有哪些,问题,包含,公司,模块
问公司法人代表变更流程及手续,问题,包含,公司,模块
问公司合并需要进行清算吗,问题,包含,公司,模块
问公司变更股东流程,问题,包含,公司,模块
问怎样才能设立一个公司呢,问题,包含,公司,模块
问企业破产清算委托合同的内容有什么,问题,包含,公司,模块
问确定股东资格可以继承吗,问题,包含,公司,模块
问公司法人与股东的责任承担是一样的吗,问题,包含,公司,模块
问要成为隐名股东需要具备哪些条件,问题,包含,公司,模块
问合资企业外资股权转让有哪些限制,问题,包含,公司,模块
问入股个人独资企业可以吗,问题,包含,公司,模块
问向股东之外的人转让股权需要多少人同意,问题,包含,公司,模块
问股东资格丧失的原因,问题,包含,公司,模块
问公司章程对股权继承的约束合法吗,问题,包含,公司,模块
问股东获得股权需满足哪些要求,问题,包含,公司,模块
问股份有限公司法人是谁,问题,包含,公司,模块
问股权赠与的法律程序是什么,问题,包含,公司,模块
问股利支付形式和程序是什么,问题,包含,公司,模块
问什么情况下股权转让协议无效,问题,包含,公司,模块
问如何证明拥有股东资格,问题,包含,公司,模块
问有限公司改制为股份公司的方式有哪些,问题,包含,公司,模块
问公司合并后的债权债务如何处理,问题,包含,公司,模块
问隐名出资人和名义股东发生纠纷怎么解决,问题,包含,公司,模块
问内资企业能转为外资企业吗,问题,包含,公司,模块
问公司无规章制度可以吗,问题,包含,公司,模块
问合同纠纷败诉对公司有影响吗,问题,包含,公司,模块
问股权转让纠纷要如何处理,问题,包含,公司,模块
问股权和分红可以分开吗,问题,包含,公司,模块
问企业子公司破产怎样申请破产清算,问题,包含,公司,模块
问清算组可以提出破产申请吗,问题,包含,公司,模块
问民营企业公司股份转让的程序,问题,包含,公司,模块
问股票代表了股东对股份公司的什么权,问题,包含,公司,模块
问股东优先购买权有行使期限吗,问题,包含,公司,模块
问收购公司和股权转让是一样的吗,问题,包含,公司,模块
问股权转让协议生效要件是怎样的,问题,包含,公司,模块
问股份转让需要走哪些法律程序,问题,包含,公司,模块
问公司的股权转让有哪些情形,问题,包含,公司,模块
问被骗当公司法人怎么办,问题,包含,公司,模块
问公司债务重组的方式主要包括,问题,包含,公司,模块
问股东继承的程序是怎样的,问题,包含,公司,模块
问有限责任公司谁有资格提起股东会,问题,包含,公司,模块
问经理对董事会负责行使什么职权,问题,包含,公司,模块
问在公司买的原始股能退吗,问题,包含,公司,模块
问公司的经营范围应该怎么确定,问题,包含,公司,模块
问公司吊销后商标怎么处理转让,问题,包含,公司,模块
问股东会决议都有效吗,问题,包含,公司,模块
问分公司可以独立承担民事责任吗,问题,包含,公司,模块
问公司公章保管人的责任,问题,包含,公司,模块
问购买公司股份后需要承担公司原有债务吗,问题,包含,公司,模块
问对于监事会公司法是怎么规定的,问题,包含,公司,模块
问公司能剥夺股东资格吗,问题,包含,公司,模块
问公司法规定有限公司法人债务如何处理,问题,包含,公司,模块
问公司法监事董事会有哪些规定,问题,包含,公司,模块
问公司收购中对小股东利益如何保护,问题,包含,公司,模块
问股东可以借钱给公司吗,问题,包含,公司,模块
问公司欠款法人代表有连带责任吗,问题,包含,公司,模块
问国企改制为有限责任公司的程序是怎么样的,问题,包含,公司,模块
问公司章程可以限定公司股东的优先购买权吗,问题,包含,公司,模块
问公司法人能管理公章吗,问题,包含,公司,模块
问个人独资公司解散条件,问题,包含,公司,模块
问股权转让收益由什么构成的,问题,包含,公司,模块
问企业股权转让需要哪些材料,问题,包含,公司,模块
问股权转让金提存是如何的,问题,包含,公司,模块
问公司破产债务是不是就消失了,问题,包含,公司,模块
问破产清算公司职责包括什么,问题,包含,公司,模块
问股权转让协议应包括哪些内容,问题,包含,公司,模块
问股权转让程序瑕疵存在哪些法律风险,问题,包含,公司,模块
问股权转让有股东不同意怎么办呢,问题,包含,公司,模块
问公司破产债权纠纷处理程序有什么,问题,包含,公司,模块
问吸收合并的主要形式包括什么,问题,包含,公司,模块
问股权转让收入的确认条件是什么,问题,包含,公司,模块
问公司如何内部股权转让,问题,包含,公司,模块
问股权质权对质权人有哪些效力,问题,包含,公司,模块
问股权转让中受让方必须要做的什么,问题,包含,公司,模块
问股权转让如何确定诉讼当事人,问题,包含,公司,模块
问如何办理股权转让,问题,包含,公司,模块
问破产清算的原因有哪些,问题,包含,公司,模块
问股东分红权能否单独转让,问题,包含,公司,模块
问股东退出公司股份方式有哪些,问题,包含,公司,模块
问公司监事要承担什么责任及义务,问题,包含,公司,模块
问谁来承担股权转让的债务,问题,包含,公司,模块
问股权转让如何生效,问题,包含,公司,模块
问股权转让适用无权处分吗,问题,包含,公司,模块
问公司法人代表写的欠条属于公司债务吗,问题,包含,公司,模块
问企业负债的偿还顺序,问题,包含,公司,模块
问有限公司注册需要满足哪些条件,问题,包含,公司,模块
问公司债务转个人可以吗,问题,包含,公司,模块
问有限责任公司股东向非股东转让股权的条件,问题,包含,公司,模块
问公司分立后股权怎么处理,问题,包含,公司,模块
问公司不分红股东能否行使股权回购请求权,问题,包含,公司,模块
问股东查阅范围是如何的,问题,包含,公司,模块
问公司债务的承担方式是怎样的,问题,包含,公司,模块
问工商变更应该要有哪些流程,问题,包含,公司,模块
问可转换公司债券合同期限是怎么规定的,问题,包含,公司,模块
问股权转让后可以增资扩股吗,问题,包含,公司,模块
问有限责任公司股东转让股权怎么做,问题,包含,公司,模块
问外资企业法人变更有哪些程序,问题,包含,公司,模块
问公司合并中对债权人有什么保护,问题,包含,公司,模块
问企业拖欠工资到哪里起诉,问题,包含,公司,模块
问国内公司在异地成立分公司手续,问题,包含,公司,模块
问上市公司发行可转换债券应符合哪些条件,问题,包含,公司,模块
问公司法人代表的年龄是多大,问题,包含,公司,模块
问有限责任公司股东人数的法律规定,问题,包含,公司,模块
问公司法人代表变更程序是什么,问题,包含,公司,模块
问公司设立子公司需要办什么手续,问题,包含,公司,模块
问股份有限公司的股东人数,问题,包含,公司,模块
问公司股东的权利和义务有哪些,问题,包含,公司,模块
问公司股东权利有什么,问题,包含,公司,模块
问公司法人变更公告都需要怎样办理,问题,包含,公司,模块
问股份有限公司发起人的法律地位和责任,问题,包含,公司,模块
问合伙企业有没有注册资本要求,问题,包含,公司,模块
问股东知情权诉讼有什么法律规定,问题,包含,公司,模块
问有限责任公司股东可以查阅公司章程吗,问题,包含,公司,模块
问争取法人代表需要哪些条件,问题,包含,公司,模块
问合同上盖的章不清楚是否可以,问题,包含,公司,模块
问有限责任公司的股东名册应包括哪些内容,问题,包含,公司,模块
问个人独资变更经营范围的资料有哪些,问题,包含,公司,模块
问实现质权要满足哪些条件,问题,包含,公司,模块
问注册公司需要哪些条件,问题,包含,公司,模块
问公司法对分公司诉讼地位的法律规定,问题,包含,公司,模块
问公司给签空白劳动合同怎么维权,问题,包含,公司,模块
问公司法对注册资本使用最低限额有何规定,问题,包含,公司,模块
问股份公司设立形式,问题,包含,公司,模块
问发行新股需要满足什么条件,问题,包含,公司,模块
问公司解散包括哪些情形,问题,包含,公司,模块
问公司法董事会的规定是怎么样的,问题,包含,公司,模块
问股东代表诉讼的当事人怎么确定,问题,包含,公司,模块
问须经股东大会特别决议的事项,问题,包含,公司,模块
问成立公司法人有什么要求,问题,包含,公司,模块
问公司合并有哪些法律后果,问题,包含,公司,模块
问公司收购需要注意的风险包括哪些内容,问题,包含,公司,模块
问企业申请工伤认定程序,问题,包含,公司,模块
问破产重整的流程是怎样的,问题,包含,公司,模块
问欠交注册资本金的责任是什么,问题,包含,公司,模块
问股东以房地产作为出资的要求是否可以,问题,包含,公司,模块
问企业法人变更程序是怎样的,问题,包含,公司,模块
问个人独资企业该如何设立分支机构,问题,包含,公司,模块
问公司恶意转移财产逃债能否向股东索要欠款,问题,包含,公司,模块
问公司法对股东分红权的规定是什么,问题,包含,公司,模块
问高管侵害公司利益，股东如何维权,问题,包含,公司,模块
问公司法中的监事会有哪些规定,问题,包含,公司,模块
问公司高级管理人员的资格和义务有哪些,问题,包含,公司,模块
问如何对抽逃出资举证责任分配,问题,包含,公司,模块
问股东会的职权是哪些,问题,包含,公司,模块
问股份有限公司设立申请条件,问题,包含,公司,模块
问公司股东变更后原合同是否有效,问题,包含,公司,模块
问企业兼并的有什么流程,问题,包含,公司,模块
问法律规定变更公司法人怎么弄,问题,包含,公司,模块
问挂名股东是否要对外承担责任,问题,包含,公司,模块
问有限责任公司成立要件是什么,问题,包含,公司,模块
问公司注册需要的资料都有哪些,问题,包含,公司,模块
问关于外商投资企业增资的手续,问题,包含,公司,模块
问清算时公司合并清算组有哪些职权,问题,包含,公司,模块
问公司法监事会的规定是什么,问题,包含,公司,模块
问公司倒闭怎么赔偿,问题,包含,公司,模块
问公司不分利润股东能退股吗,问题,包含,公司,模块
问非法雇佣童工罚款有什么法律规定,问题,包含,公司,模块
问行政处罚的追诉时效,问题,包含,公司,模块
问民营企业破产清偿顺序,问题,包含,公司,模块
问投资人股东以土地使用权可以出资么,问题,包含,公司,模块
问股东的查阅权是什么,问题,包含,公司,模块
问法人代表对外行使什么权利,问题,包含,公司,模块
问合伙财产份额转让的规定,问题,包含,公司,模块
问有权申请司法解散公司的情况是怎样的,问题,包含,公司,模块
问营业执照正确的办理方式是什么,问题,包含,公司,模块
问股东在公司法起诉有什么条件,问题,包含,公司,模块
问隐名股东的担保能力是如何规定的,问题,包含,公司,模块
问股东不增资有什么后果,问题,包含,公司,模块
问在我国公司法人和股东谁大,问题,包含,公司,模块
问公司法的表决权怎么确定,问题,包含,公司,模块
问股权转让的条件有哪些,问题,包含,公司,模块
问隐名股东要成为显名股东要如何做,问题,包含,公司,模块
问有限公司改制为股份有限公司怎么进行,问题,包含,公司,模块
问股东在公司内部转让股份有效吗,问题,包含,公司,模块
问商号转让有哪些法律规定,问题,包含,公司,模块
问股东资格的取得方式有哪些,问题,包含,公司,模块
问公司不承认股东享有股权怎么办,问题,包含,公司,模块
问公司被吊销可以重新开业吗,问题,包含,公司,模块
问什么情况下可以进行公司合并,问题,包含,公司,模块
问有限责任公司的股权转让的程序是什么,问题,包含,公司,模块
问法人以其全部财产独立承担民事责任吗,问题,包含,公司,模块
问股东退出公司的有效方法有几种,问题,包含,公司,模块
问股东权能否被强行转让呢,问题,包含,公司,模块
问企业破产清算财产有什么顺序,问题,包含,公司,模块
问股东是否有权提起公司人格否认之诉,问题,包含,公司,模块
问公司股东应该怎样享有分红权,问题,包含,公司,模块
问上市公司股份如何进行回购,问题,包含,公司,模块
问投资公司能否作为委托人,问题,包含,公司,模块
问怎样才能将公司的股权进行转让,问题,包含,公司,模块
问股权转让中谁具有诉讼主体资格,问题,包含,公司,模块
问公司法人代表的职责有什么,问题,包含,公司,模块
问法律是如何规定股东查阅权和复制摘抄权的,问题,包含,公司,模块
问隐名股东如何有法律效力,问题,包含,公司,模块
问转让有瑕疵的股权该怎样确定赔偿,问题,包含,公司,模块
问少数股东权益有哪些,问题,包含,公司,模块
问中小股东行使股东诉权有哪几种方式,问题,包含,公司,模块
问关于少数股东权益有何规定,问题,包含,公司,模块
问公司解散效力的分类有哪些,问题,包含,公司,模块
