question,question_tag,property,model,model_tag
问企业战略的构成要素有哪些,问题,包含,公司,模块
问股权转让后如何处理未分配利润,问题,包含,公司,模块
问董事会有权解释公司章程吗,问题,包含,公司,模块
问企业上市都需要哪些条件呢,问题,包含,公司,模块
问什么情况是不能担任公司法定代表人,问题,包含,公司,模块
问公司法注册方式认缴制如何进行规定的,问题,包含,公司,模块
问公司应怎么进行破产清算,问题,包含,公司,模块
问股东会普通决议事项包括哪些,问题,包含,公司,模块
问侵害股东权益时股东如何起诉,问题,包含,公司,模块
问股份有限公司股东人数是多少,问题,包含,公司,模块
问可以不设股东会吗,问题,包含,公司,模块
问验资报告能证明出资了吗,问题,包含,公司,模块
问出资不实需要承担违约责任吗,问题,包含,公司,模块
问一人有多家有限公司申请破产后需要还债吗,问题,包含,公司,模块
问股份有限公司发起设立的程序是什么,问题,包含,公司,模块
问非上市公司收购基本程序有哪些,问题,包含,公司,模块
问设立分公司的条件有哪些,问题,包含,公司,模块
问股东缴纳出资期限,问题,包含,公司,模块
问企业申请破产的条件,问题,包含,公司,模块
问企业偷税漏税要怎么处罚,问题,包含,公司,模块
问抽逃出资的义务是什么,问题,包含,公司,模块
问召开股东大会通知提前多久发出,问题,包含,公司,模块
问公司回购股东的股权的情况有哪些,问题,包含,公司,模块
问股份公司解散条件都有哪些,问题,包含,公司,模块
问公司破产的清偿顺序,问题,包含,公司,模块
问公司更改名称需要什么,问题,包含,公司,模块
问股东退股后还分红吗,问题,包含,公司,模块
问公司监事变更流程是什么,问题,包含,公司,模块
问注册资本金可以使用吗,问题,包含,公司,模块
问企业吊销如何恢复,问题,包含,公司,模块
问公司申请破产是否需要股东同意,问题,包含,公司,模块
问母公司不上市子公司能上市吗,问题,包含,公司,模块
问申请破产后有什么限制,问题,包含,公司,模块
问公司法人违法约定的免责协议是否有效,问题,包含,公司,模块
问营业执照遗失如何补办,问题,包含,公司,模块
问绝对控股可以要求股东退出吗,问题,包含,公司,模块
问公司解散效力都有哪些,问题,包含,公司,模块
问有限责任公司股东不履行职责如何处理,问题,包含,公司,模块
问企业申请破产要满足什么条件,问题,包含,公司,模块
问债权人申请公司破产的条件,问题,包含,公司,模块
问一人有限公司和多人有限公司区别,问题,包含,公司,模块
问公司股东不和怎样处理,问题,包含,公司,模块
问股权代持人算是公司股东吗,问题,包含,公司,模块
问企业变更法人债务怎么办,问题,包含,公司,模块
问工作的同时可以注册公司吗,问题,包含,公司,模块
问隐名股东怎样退股,问题,包含,公司,模块
问股份有限公司可以通过什么方式设立,问题,包含,公司,模块
问认缴制能否直接追加股东,问题,包含,公司,模块
问有限公司股权转让规则是什么,问题,包含,公司,模块
问公司注册资本能取回吗,问题,包含,公司,模块
问破产清算的条件是什么,问题,包含,公司,模块
问企业注销后被起诉,问题,包含,公司,模块
问没有实缴的股权可以转让吗,问题,包含,公司,模块
问股东可以以现金入股吗,问题,包含,公司,模块
问债务人申请破产提交哪些资料,问题,包含,公司,模块
问股权转让情形是怎样的呢,问题,包含,公司,模块
问公司三分之二表决权可否修改,问题,包含,公司,模块
问股权转让需要登报吗,问题,包含,公司,模块
问拥有股票就拥有股权吗,问题,包含,公司,模块
问企业的清算所得是什么,问题,包含,公司,模块
问企业破产就不用还债了吗,问题,包含,公司,模块
问监事是高管吗,问题,包含,公司,模块
问干股与工资是并存的吗,问题,包含,公司,模块
问公司名称变更要如何办理,问题,包含,公司,模块
问公司股东之间可以股权质押吗,问题,包含,公司,模块
问股权转让协议的内容有哪些,问题,包含,公司,模块
问普通合伙人的退伙方式,问题,包含,公司,模块
问继承股东的权利有哪些呢,问题,包含,公司,模块
问一人公司设立的程序是什么,问题,包含,公司,模块
问公司可以起诉控股股东吗,问题,包含,公司,模块
问哪些企业有法人资格,问题,包含,公司,模块
问公司法关于监事会的规定是什么,问题,包含,公司,模块
问公司章程无效的情形有什么,问题,包含,公司,模块
问投资公司设立条件有哪些,问题,包含,公司,模块
问被告公司注销怎么处理,问题,包含,公司,模块
问进行公司注册地址备案需要的材料有哪些,问题,包含,公司,模块
问股东直接诉讼适用情形有哪些,问题,包含,公司,模块
问股东决议对什么人有效的,问题,包含,公司,模块
问公司设立登记申请书是自己写的吗,问题,包含,公司,模块
问合伙人应具备的条件有哪些,问题,包含,公司,模块
问公司犯罪由谁承担责任呢,问题,包含,公司,模块
问公司法人代表有哪些权利呢,问题,包含,公司,模块
问是否可以在股权质押的状态下转让股权,问题,包含,公司,模块
问企业注销后还可以上诉吗,问题,包含,公司,模块
问监事能不能是股东,问题,包含,公司,模块
问小股东是否有查账的权利,问题,包含,公司,模块
问企业注销怎么办理,问题,包含,公司,模块
问公司发起人的责任义务有什么,问题,包含,公司,模块
问普通合伙企业的设立条件哪些,问题,包含,公司,模块
问公司解散清算的流程是怎样的,问题,包含,公司,模块
问公司破产清算赔偿顺序及依据有哪些,问题,包含,公司,模块
问股东没有实际出资能分红吗,问题,包含,公司,模块
问公司的债务法人需要承担吗,问题,包含,公司,模块
问总公司与分公司的关系是什么,问题,包含,公司,模块
问上市公司申请增发新股的条件主要有什么,问题,包含,公司,模块
问自然股东承担什么责任,问题,包含,公司,模块
问分公司是否能代表总公司起诉,问题,包含,公司,模块
问合伙企业的债务清偿顺序是怎样的,问题,包含,公司,模块
问个人退股需要什么手续,问题,包含,公司,模块
问股东如何变更,问题,包含,公司,模块
问公司吊销未注销会有什么后果,问题,包含,公司,模块
问设立外资企业的条件是什么,问题,包含,公司,模块
问挂名股东合法吗,问题,包含,公司,模块
问合伙企业的合伙协议在什么时候生效,问题,包含,公司,模块
问吊销营业执照的后果是什么,问题,包含,公司,模块
问股权转让违约必须继续履行合约吗,问题,包含,公司,模块
问公司名称变更流程是什么,问题,包含,公司,模块
问如何清算被解散公司,问题,包含,公司,模块
问有限公司能否上市,问题,包含,公司,模块
问公司法人变更流程有哪些,问题,包含,公司,模块
问外国人可以当内资公司的法定代表人吗,问题,包含,公司,模块
问公司股份变更流程,问题,包含,公司,模块
问公司快倒闭了如何处理,问题,包含,公司,模块
问股东撤回出资怎么办,问题,包含,公司,模块
问以股东会决议对外签订合同的效力有效吗,问题,包含,公司,模块
问偷税逃税属于违法行为吗,问题,包含,公司,模块
问股权转让过户后未支付对价是否有效,问题,包含,公司,模块
问股东不同意公司分立怎么办,问题,包含,公司,模块
问股东享有优先购买权的法律有哪些,问题,包含,公司,模块
问有限公司可以申请破产吗,问题,包含,公司,模块
问设立有限责任公司应当具备哪些条件,问题,包含,公司,模块
问股份有限公司怎样发起设立,问题,包含,公司,模块
问分公司变更登记应提交哪些材料,问题,包含,公司,模块
问公司股东股权转让流程是什么,问题,包含,公司,模块
问注册资本金认缴期限多长,问题,包含,公司,模块
问监事承担什么法律责任,问题,包含,公司,模块
问公司财产不足以清偿债务怎么办,问题,包含,公司,模块
问破产申请的主体是什么,问题,包含,公司,模块
问隐名股东法律责任有哪些,问题,包含,公司,模块
问小公司破产清算程序,问题,包含,公司,模块
问注册公司需要的手续是什么,问题,包含,公司,模块
问变更法人代表需要哪些手续,问题,包含,公司,模块
问股东解散子公司流程,问题,包含,公司,模块
问搬厂员工不去老板应该如何赔偿,问题,包含,公司,模块
问股东是否承担债务,问题,包含,公司,模块
问股东如何起诉公司,问题,包含,公司,模块
问同一地址是否可以注册两个公司,问题,包含,公司,模块
问有限公司注册资金以后是否可以转出来,问题,包含,公司,模块
问合伙企业债务承担的方式是什么,问题,包含,公司,模块
问公司法定代表人的任职资格是什么呢,问题,包含,公司,模块
问认缴资金不到位的后果是什么呢,问题,包含,公司,模块
问商法人变更需要多长时间,问题,包含,公司,模块
问股东是否可以查阅公司会计账簿,问题,包含,公司,模块
问清算组行使什么职权呢,问题,包含,公司,模块
问股东增资的连带责任有哪些,问题,包含,公司,模块
问股权质押后怎么实现股权质权,问题,包含,公司,模块
问隐名股东权益包括什么呢,问题,包含,公司,模块
问股东的出资方式包括哪些,问题,包含,公司,模块
问设立有限公司的出资方式有哪些,问题,包含,公司,模块
问分公司财务是否可以独立,问题,包含,公司,模块
问公司是否可以成为合伙人,问题,包含,公司,模块
问隐名股东可以诉讼吗,问题,包含,公司,模块
问股份公司发起人的责任有哪些,问题,包含,公司,模块
问股权转让交的税有哪些,问题,包含,公司,模块
问有限责任公司的解散情形有什么,问题,包含,公司,模块
问合伙人应负的责任有什么,问题,包含,公司,模块
问由谁承担公司破产后债务,问题,包含,公司,模块
问公司法股份公司股权转让的规定有哪些,问题,包含,公司,模块
问清算组的职权有什么,问题,包含,公司,模块
问公司与股东的财产混同股东要担责吗,问题,包含,公司,模块
问外国企业分支机构登记程序有哪些,问题,包含,公司,模块
问企业增资怎么办理,问题,包含,公司,模块
问不正当竞争的构成要件有哪些,问题,包含,公司,模块
问保险公司破产个人保单怎么办,问题,包含,公司,模块
问股东大会的对于参与的股东的要求有什么,问题,包含,公司,模块
问公司前任股东应该享有知情权吗,问题,包含,公司,模块
问分公司变更登记应提交的材料有哪些,问题,包含,公司,模块
问一人公司是什么呢,问题,包含,公司,模块
问企业注销后还可以立案吗,问题,包含,公司,模块
问个人怎么成立一家私募公司,问题,包含,公司,模块
问注册企业名称的要求是什么,问题,包含,公司,模块
问设立股份公司的出资方式有什么,问题,包含,公司,模块
问企业经营中要如何约定竞业限制的条款,问题,包含,公司,模块
问仲裁赔偿公司账户没钱怎么处理,问题,包含,公司,模块
问法人是否承担公司债务,问题,包含,公司,模块
问企业破产，股东需要承担责任吗,问题,包含,公司,模块
问股东会多长时间召开一次,问题,包含,公司,模块
问注册新公司需要的资料有哪些,问题,包含,公司,模块
问注销的公司是否能当被告,问题,包含,公司,模块
问合伙企业营业执照到期法律后果有什么,问题,包含,公司,模块
问收购公司的注意事项是什么,问题,包含,公司,模块
问全资子公司法人变更是否需母公司同意,问题,包含,公司,模块
问股权质押是否须经股东会认可,问题,包含,公司,模块
问有限责任公司股东人数有什么要求呢,问题,包含,公司,模块
问公司法人代表的任职资格是什么呢,问题,包含,公司,模块
问股东是否可以开同行业公司,问题,包含,公司,模块
问认缴制股权转让协议的要求有哪些,问题,包含,公司,模块
问有限责任公司怎么改为股份有限公司,问题,包含,公司,模块
问董事会行使什么职权呢,问题,包含,公司,模块
问公司注册需要的资料有哪些,问题,包含,公司,模块
问公司清算一般要多久呢,问题,包含,公司,模块
问申请公司需要的手续有哪些,问题,包含,公司,模块
问没上市的公司是否可以转让股权,问题,包含,公司,模块
问法人变更公司债务是否有关系,问题,包含,公司,模块
问大股东是否有权变更法人,问题,包含,公司,模块
问有限责任公司股东的权利可以被继承吗,问题,包含,公司,模块
问公司监事会职责有哪些呢,问题,包含,公司,模块
问清算该走哪些程序呢,问题,包含,公司,模块
问公司能把商标转让给个人吗,问题,包含,公司,模块
问合伙企业能叫公司吗,问题,包含,公司,模块
问有限责任公司董事会人数规定是什么,问题,包含,公司,模块
问公司是否可以向股东借款,问题,包含,公司,模块
问公司股份回购条件是什么,问题,包含,公司,模块
问公司欠债是否可以查封股东个人住房,问题,包含,公司,模块
问公司什么情况下被吊销,问题,包含,公司,模块
问公司股东借款能否追加公司为被告,问题,包含,公司,模块
问董事监事资格的限制有哪些,问题,包含,公司,模块
问变更董事会成员需要哪些材料,问题,包含,公司,模块
问公司董事必须是股东吗,问题,包含,公司,模块
问身为一名公司股东有哪些权利和义务,问题,包含,公司,模块
问股东认缴出资多久到位,问题,包含,公司,模块
问两个异地的公司可以合并吗,问题,包含,公司,模块
问公司能注销吗,问题,包含,公司,模块
问股权已质押还可以出售吗,问题,包含,公司,模块
问公司的大股东的责任,问题,包含,公司,模块
问有限公司有必须成立董事会吗,问题,包含,公司,模块
问小公司可用股权激励吗,问题,包含,公司,模块
问强制执行时效是多久,问题,包含,公司,模块
问股东会决议是需要多少票数通过,问题,包含,公司,模块
问股东职权有哪些法律规定,问题,包含,公司,模块
问公司重组收购在哪里备案,问题,包含,公司,模块
问国际货运代理企业的法律地位怎么样,问题,包含,公司,模块
问股东权益受侵害的维护,问题,包含,公司,模块
问什么是股权登记,问题,包含,公司,模块
问企业兼并主要形式有哪些,问题,包含,公司,模块
问股权确认书的适用范围是什么,问题,包含,公司,模块
问如何进行股权登记,问题,包含,公司,模块
问股东有没有权了解公司在经营管理上的信息,问题,包含,公司,模块
问股份有限公司股东出资规则,问题,包含,公司,模块
问大股东如何行使股东权利,问题,包含,公司,模块
问股权质押需要评估吗,问题,包含,公司,模块
问企业分立属不属于重组,问题,包含,公司,模块
问新公司法对虚假注册的规定有哪些,问题,包含,公司,模块
问法人成立必须具备的条件有哪些,问题,包含,公司,模块
问股东权中的权是否能转让合法,问题,包含,公司,模块
问股权变更的理由有什么,问题,包含,公司,模块
问企业间相互担保违法吗,问题,包含,公司,模块
问一人有限公司是否要设股东会,问题,包含,公司,模块
问注销一家公司一定要股东到场吗,问题,包含,公司,模块
问公司解散后清算组成员如何定,问题,包含,公司,模块
问有限责任公司清算顺序是怎么规定的,问题,包含,公司,模块
问有限责任公司股东人数是什么,问题,包含,公司,模块
问股东可以行使的权利有哪些,问题,包含,公司,模块
问未清算公司债务承担主体是谁,问题,包含,公司,模块
问公司上市时商标权应当怎么处理,问题,包含,公司,模块
问公司合并债权人能提出异议吗,问题,包含,公司,模块
问申请破产期间公司是否经营,问题,包含,公司,模块
问挂靠股东如何才能退出,问题,包含,公司,模块
问股份公司怎么募集设立的,问题,包含,公司,模块
问公司财产不足以清偿债务怎么处理,问题,包含,公司,模块
问民营企业债权的融资方式有哪些,问题,包含,公司,模块
问未实缴股权能否分到财产,问题,包含,公司,模块
问公司设立时发行股票的程序,问题,包含,公司,模块
问股东代表诉讼和代位诉讼的区别,问题,包含,公司,模块
问什么是股权投资,问题,包含,公司,模块
问装修合同书如何写,问题,包含,公司,模块
问购房合同纠纷找哪些部门,问题,包含,公司,模块
问合同上只盖公章有法律效力吗,问题,包含,公司,模块
问投资合同需要注意什么,问题,包含,公司,模块
问有限公司自行清算的具体程序有什么,问题,包含,公司,模块
问遇到商业车险赔付同等责任的情况怎么办,问题,包含,公司,模块
问公司形式有哪些,问题,包含,公司,模块
问什么叫做股权投资,问题,包含,公司,模块
问股权收购与转让的区别,问题,包含,公司,模块
问董监高的忠实义务包括什么内容,问题,包含,公司,模块
问隐名股东要成为显名股东要怎么去做,问题,包含,公司,模块
问公司的法人和股东一般谁大,问题,包含,公司,模块
问股东退出公司有哪些合法方式,问题,包含,公司,模块
问公司不承认股东享有股权如何来办,问题,包含,公司,模块
问股东权可以被强行转让吗,问题,包含,公司,模块
问股东资格的取得方式有什么,问题,包含,公司,模块
问公司法的表决权如何来确定,问题,包含,公司,模块
问法律是怎么去规定股东查阅权和复制摘抄权的,问题,包含,公司,模块
问公司股东的分红权怎么规定,问题,包含,公司,模块
问公司名字被抢注商标怎么去解决,问题,包含,公司,模块
问股权转让时谁有诉讼主体资格,问题,包含,公司,模块
问公司法人代表的职责有哪些,问题,包含,公司,模块
问转让有瑕疵的股权如何来确定赔偿,问题,包含,公司,模块
问少数股东权益有什么,问题,包含,公司,模块
问中小股东行使股东诉权包括什么方式,问题,包含,公司,模块
问公司解散效力的分类有什么,问题,包含,公司,模块
问少数股东的权益怎么规定,问题,包含,公司,模块
问商家恶意散布谣言构成不正当竞争吗,问题,包含,公司,模块
问企业欠款法定代表人是否要承担责任,问题,包含,公司,模块
问股东瑕疵出资会影响行使股东权利吗,问题,包含,公司,模块
问法律对保护优先购买权是怎么去规定的,问题,包含,公司,模块
问股东的知情权如何依法行使,问题,包含,公司,模块
问派出所关押期限怎么规定,问题,包含,公司,模块
问上市公司股份怎么去进行回购,问题,包含,公司,模块
问上市公司新股发行需要满足哪些条件,问题,包含,公司,模块
问股东变更后需要税务登记也需要变更吗,问题,包含,公司,模块
问分公司的性质是什么在法律规定上怎么认定其性质,问题,包含,公司,模块
问隐名股东能不能直接向公司主张权利呢,问题,包含,公司,模块
问公司的工作人员索贿受贿的会面临哪些处罚,问题,包含,公司,模块
问哪些会计项目不得用于扣除企业所得税呀,问题,包含,公司,模块
问公司法人变更是否需要清算,问题,包含,公司,模块
问新成立的公司允许变更监事吗,问题,包含,公司,模块
问公司回购的股票属于谁,问题,包含,公司,模块
问股东抽逃出资处理方式有哪些,问题,包含,公司,模块
问上市公司收购上市公司条件如何,问题,包含,公司,模块
问同一人可以任多个公司的法定代表人吗,问题,包含,公司,模块
问股权质押后可不可以过户,问题,包含,公司,模块
问设立合伙企业应当具备什么条件,问题,包含,公司,模块
问公司没破产也可以解散吗,问题,包含,公司,模块
问有限责任公司的股东可以出资的方式有什么呢,问题,包含,公司,模块
问股东可以用自己的股权投资嘛,问题,包含,公司,模块
问公司不配合申请工伤认定怎么办,问题,包含,公司,模块
问股东未实缴出资应承担的责任具有哪些,问题,包含,公司,模块
问成立股份有限公司的条件有哪些,问题,包含,公司,模块
问《公司法》对公司清算组成员有哪些规定,问题,包含,公司,模块
问发起人设立注册公司需要承担的法律责任有哪些,问题,包含,公司,模块
问公司倒闭后能找原法人或者股东追究责任吗,问题,包含,公司,模块
问股份公司股东大会是如何去决议的,问题,包含,公司,模块
问股权纠纷诉讼时效规定,问题,包含,公司,模块
问中外合资企业法律要求设立监事会吗,问题,包含,公司,模块
问公司法人代表是否可以不是股东,问题,包含,公司,模块
问股份有限公司的经理具有何种职权,问题,包含,公司,模块
问丧失股东资格的股东能不能提起股东代表诉讼,问题,包含,公司,模块
问股东代表诉讼胜诉利益归谁,问题,包含,公司,模块
问股份有限公司的发起人应承担哪些责任,问题,包含,公司,模块
问股东的出资方式有什么呢,问题,包含,公司,模块
问对赌协议符合法律规定吗,问题,包含,公司,模块
问公司法中董事会人数有何规定,问题,包含,公司,模块
问公司拖欠工资该怎么办呢,问题,包含,公司,模块
问已经做了股权质押能够转户吗,问题,包含,公司,模块
问公司倒闭了是找法人还是找股东追究责任,问题,包含,公司,模块
问公司分立有哪些程序,问题,包含,公司,模块
问股权转让有哪几种方式呀,问题,包含,公司,模块
问车祸后保险公司赔偿后个人还要不要赔偿,问题,包含,公司,模块
问担任多个公司法人代表是可以的吗,问题,包含,公司,模块
问董事任命是否需要经股东会,问题,包含,公司,模块
问公司分立的法定形式包括什么,问题,包含,公司,模块
问董事会的三大职能是什么呢,问题,包含,公司,模块
问高级管理人员有哪些呢,问题,包含,公司,模块
问公司法对股东出资的有哪些规定呢,问题,包含,公司,模块
问有限责任公司董事的任期是如何规定的,问题,包含,公司,模块
问公司法人代表是不是老板,问题,包含,公司,模块
问法定代表人可以减资嘛,问题,包含,公司,模块
问与并购无关的商业秘密应怎样保护,问题,包含,公司,模块
问非法人企业具体有哪些,问题,包含,公司,模块
问怎么样把隐名股东变为显名,问题,包含,公司,模块
问公司破产的清偿按怎样的顺序进行,问题,包含,公司,模块
"问名义股东要求退出公司的,要如何退出公司",问题,包含,公司,模块
问公务员可以当公司法人吗,问题,包含,公司,模块
问挂名公司的法人代表如何降低风险,问题,包含,公司,模块
问闯红灯出车祸保险公司要赔吗,问题,包含,公司,模块
问公司注册是否需要公司章程,问题,包含,公司,模块
问国有独资公司允许进行增资扩股吗,问题,包含,公司,模块
问公司与员工签劳务协议是否违法,问题,包含,公司,模块
问破产申请书包括哪些内容呢,问题,包含,公司,模块
问公司已经成立还用再缴出资吗,问题,包含,公司,模块
问公司欠钱可不可以抓法人,问题,包含,公司,模块
问公司注销原法人还需不需要承担民事责任,问题,包含,公司,模块
问合伙公司中的合伙人要承担哪些合伙债务,问题,包含,公司,模块
问公司超越经营范围怎么进行处罚,问题,包含,公司,模块
"问公司内部以处罚员工为目的张贴员工照片,是否肖像侵权",问题,包含,公司,模块
问新公司法法定公积金有什么相关法律规定,问题,包含,公司,模块
问抵押人破产的可以行使抵押权吗,问题,包含,公司,模块
问有限责任公司可不可以转为个人独资企业,问题,包含,公司,模块
问公司法对外投资规定限制有哪些呢,问题,包含,公司,模块
问有限责任公司最低注册资本是多少,问题,包含,公司,模块
问债权人会议应当符合哪些规定,问题,包含,公司,模块
问设立股份有限公司需要满足什么,问题,包含,公司,模块
问开公司登记时要哪些文件,问题,包含,公司,模块
问法定代表人可以减资吗,问题,包含,公司,模块
问农村集体经济组织股权证什么意思,问题,包含,公司,模块
问要如何注销公司,问题,包含,公司,模块
问公司分立是否需要进行公告,问题,包含,公司,模块
问分公司负责人是不是法定代表人,问题,包含,公司,模块
问公司法对股东出资的规定有哪些呢,问题,包含,公司,模块
