question,question_tag,property,model,model_tag
问有限责任公司召开股东大会流程是什么,问题,包含,公司,模块
问事业编制当法人的后果是什么呢,问题,包含,公司,模块
问公司散伙的情形有哪些,问题,包含,公司,模块
问担任法人是否有年龄限制,问题,包含,公司,模块
问有限责任公司股东不履行职责应该怎样处理呢,问题,包含,公司,模块
问有限合伙人对合伙企业债务承担的责任有什么民事责任,问题,包含,公司,模块
问一人有限责任公司可以不设监事会吗,问题,包含,公司,模块
问收据照片有法律效力吗,问题,包含,公司,模块
问法人清算程序有哪些,问题,包含,公司,模块
问公司章程的内容有什么呢,问题,包含,公司,模块
问公司破产后的清算是按照什么顺序,问题,包含,公司,模块
问必须为法定代表人缴纳社保吗,问题,包含,公司,模块
问出资人享有什么样的权利,问题,包含,公司,模块
问股东认缴出资方式应遵循什么规定,问题,包含,公司,模块
问法人和法人代表到底有什么区别,问题,包含,公司,模块
问员工违法企业有没有连带责任,问题,包含,公司,模块
问公司中小股东享有什么权利,问题,包含,公司,模块
问非自然人投资或控股是否是国企呢,问题,包含,公司,模块
问注销公司有什么流程,问题,包含,公司,模块
问个人独资企业可以设立法人吗,问题,包含,公司,模块
问股东法定代表人的个人借款其他股东需要负责偿还吗,问题,包含,公司,模块
问股份公司减资的方式有哪些,问题,包含,公司,模块
问法律是怎么规定清算组成员的,问题,包含,公司,模块
问股东大会出席人数规定是什么呢,问题,包含,公司,模块
问欠款是找法人还是实际控制人呢,问题,包含,公司,模块
问非全日制合同有试用期吗,问题,包含,公司,模块
问公司欠钱不还怎么办呢,问题,包含,公司,模块
问个人合伙退伙财产分割怎么处理,问题,包含,公司,模块
问国有独资公司是否能增资扩股,问题,包含,公司,模块
问公司因为倒闭解散会有赔偿吗,问题,包含,公司,模块
问小公司多久才能注销,问题,包含,公司,模块
问法人可以申请精神损害赔偿吗,问题,包含,公司,模块
问挂名股东能否享有股东权益,问题,包含,公司,模块
问产假的工资是公司给还是国家给呢,问题,包含,公司,模块
问有限责任公司董事的任期是多长时间呀,问题,包含,公司,模块
问合伙企业减资是否要登报,问题,包含,公司,模块
问我国股东代表诉讼被告范围是怎样的,问题,包含,公司,模块
问注销公司时需要准备哪些流程,问题,包含,公司,模块
问监事和执行董事谁大,问题,包含,公司,模块
问股东认缴出资应遵循什么规定,问题,包含,公司,模块
问抽逃注册资金该承担什么责任,问题,包含,公司,模块
问认缴期内公司注销是否要继续缴纳出资,问题,包含,公司,模块
问股东退出需要什么手续,问题,包含,公司,模块
问股东会的决议需要签字吗,问题,包含,公司,模块
问股份有限公司募集设立的法律规定,问题,包含,公司,模块
问董事会职权和股东会职权,问题,包含,公司,模块
问受伤后公司不申报工伤怎么办,问题,包含,公司,模块
问设立子公司的流程,问题,包含,公司,模块
问有强制退出股东的规定吗,问题,包含,公司,模块
问股东虚假出资法律是怎么去规定的,问题,包含,公司,模块
问监事的职责有什么,问题,包含,公司,模块
问担保债权有哪些优先性限制,问题,包含,公司,模块
问房地产公司清算要经过的程序是什么呢,问题,包含,公司,模块
问签约合同违约应当怎样处理呀,问题,包含,公司,模块
问买房签合同是不是要夫妻两人一起,问题,包含,公司,模块
问公司不续签第四次合同如何赔偿,问题,包含,公司,模块
问授权代表签订协议还需要为此负法律责任么,问题,包含,公司,模块
问合同诈骗罪立案标准和构成要件是什么,问题,包含,公司,模块
问千分之一违约金是否合法呢,问题,包含,公司,模块
问撤销合同和解除合同有什么区别,问题,包含,公司,模块
问贷款遇到诈骗签了合同有没有效力,问题,包含,公司,模块
问变更旅游合同需要遵循的原则是什么,问题,包含,公司,模块
问破产清算优先偿还的是什么,问题,包含,公司,模块
问破产的分公司欠债怎么偿还,问题,包含,公司,模块
问公司破产清算高利贷需要偿还吗,问题,包含,公司,模块
问破产清算公司如何核算,问题,包含,公司,模块
问公司清算的程序是怎么样,问题,包含,公司,模块
问股东变更的时间是多久,问题,包含,公司,模块
问股权可不可以进行低价转让吗,问题,包含,公司,模块
问股东的个人股权可不可以质押贷款吗,问题,包含,公司,模块
问公司破产清算步骤是什么,问题,包含,公司,模块
问我国公司法中对董事会的规定是什么,问题,包含,公司,模块
问公司合并条件有哪些,问题,包含,公司,模块
问股权转让纠纷管辖法院如何确定,问题,包含,公司,模块
问企业进行裁员满足的条件是什么,问题,包含,公司,模块
问公司法人变更的税务也需要变更吗,问题,包含,公司,模块
问公司法不设股东会可以么,问题,包含,公司,模块
问分立程序是什么,问题,包含,公司,模块
问在我国公司法人代表有没有工资的,问题,包含,公司,模块
问股份有限公司变更需要什么材料,问题,包含,公司,模块
问公司法上市公司的符合条件是什么,问题,包含,公司,模块
问公司法中关于股东知情权的规定是什么,问题,包含,公司,模块
问公司法中董事长职权有什么,问题,包含,公司,模块
问如何理解股权转让的同等条件,问题,包含,公司,模块
问股权转让代持协议无效情形有哪些,问题,包含,公司,模块
问合伙双方仅作口头约定会有哪些问题,问题,包含,公司,模块
问能否查封股东出资额同等价值的财产,问题,包含,公司,模块
问破产撤销权适用的条件有哪些,问题,包含,公司,模块
问公司盈余分配顺序,问题,包含,公司,模块
问公司收童工罚款归谁管辖,问题,包含,公司,模块
问公司法定代表人能否起诉股东,问题,包含,公司,模块
问分公司法人变更手续是怎样的,问题,包含,公司,模块
问公司法人变更后营业执照需要变更吗,问题,包含,公司,模块
问公司法人代表的年龄有什么要求,问题,包含,公司,模块
问企业分立条件是什么,问题,包含,公司,模块
问股东知情权范围是什么,问题,包含,公司,模块
问分公司注册成立需要具备什么条件,问题,包含,公司,模块
问公司的债务要由股东来还吗,问题,包含,公司,模块
问个人可以担任多个公司法人代表吗,问题,包含,公司,模块
问股权变更办理流程怎么走,问题,包含,公司,模块
问变更公司地址需要的资料有哪些,问题,包含,公司,模块
问公司注销后多长时间内不能起诉,问题,包含,公司,模块
问企业破产后债务的承担方是谁,问题,包含,公司,模块
问如何注销公司,问题,包含,公司,模块
问注销工商执照需要什么材料,问题,包含,公司,模块
问有限责任公司股东的权利能被继承吗,问题,包含,公司,模块
问企业集团注销登记需要提交哪些材料,问题,包含,公司,模块
问公司债务谁承担,问题,包含,公司,模块
问有限公司股权可以转让吗？,问题,包含,公司,模块
问董事会人数规定,问题,包含,公司,模块
问不正当竞争行为的种类,问题,包含,公司,模块
问股东能撒销公司对外签订的合同吗,问题,包含,公司,模块
问股份代持有人数限制吗,问题,包含,公司,模块
问股东不继续投资可以吗,问题,包含,公司,模块
问董事会有哪些职权,问题,包含,公司,模块
问公司监事人承担什么法律责任,问题,包含,公司,模块
问公司法人变更后果严重吗,问题,包含,公司,模块
问公司股东享有哪些权利,问题,包含,公司,模块
问公司为股东如何提供担保,问题,包含,公司,模块
问分公司注销流程是怎样的,问题,包含,公司,模块
问公司股东更换流程,问题,包含,公司,模块
问公司设立登记申请书是自己写吗,问题,包含,公司,模块
问注销股东身份诉讼时效多久,问题,包含,公司,模块
问股东权利包括表决权吗,问题,包含,公司,模块
问注销企业还能恢复吗,问题,包含,公司,模块
问公司清算的赔偿顺序是怎样的,问题,包含,公司,模块
问新公司法股东知情权有哪些规定,问题,包含,公司,模块
问公司债券暂停上市的原因包括哪些,问题,包含,公司,模块
问虚假出资的股份转让股东承担什么责任,问题,包含,公司,模块
问公司法变更法定代表人的规定是什么,问题,包含,公司,模块
"﻿""",问题,包含,公司,模块
问,问题,包含,公司,模块
"公司分立股东能变更吗""",问题,包含,公司,模块
问股权转让前置条件是什么,问题,包含,公司,模块
问在我国公司法人是否可以承担债务,问题,包含,公司,模块
问公司股东变更的流程是怎样的,问题,包含,公司,模块
问法定代表人变更的程序是什么,问题,包含,公司,模块
问法人可以担任清算组成员吗,问题,包含,公司,模块
问破产申请不予受理怎么办,问题,包含,公司,模块
问公司法股东撤资方式有哪些,问题,包含,公司,模块
问出租人有权终止合同的情形有哪些,问题,包含,公司,模块
问对方拖欠房租费解除合同该怎样办,问题,包含,公司,模块
问侵犯商业秘密罪赔偿标准是什么,问题,包含,公司,模块
问没有债权人名字的欠条是否有效,问题,包含,公司,模块
问公司偷税漏税谁承担责任,问题,包含,公司,模块
问公司法人股份转让需要准备哪些材料,问题,包含,公司,模块
问公司法股东会法定人数有多少,问题,包含,公司,模块
问公司法人治理结构形式和内容有哪些,问题,包含,公司,模块
问公司能与股东签订合同吗,问题,包含,公司,模块
问公司章程如何变更,问题,包含,公司,模块
问公司分立后的债务承担,问题,包含,公司,模块
问滥用股东权利有哪些情形,问题,包含,公司,模块
问清算组的职权有哪些,问题,包含,公司,模块
问公司非法吸收公众存款股东有何责任,问题,包含,公司,模块
问股权继承有哪些法律规定,问题,包含,公司,模块
问股东不同意放弃股权如何处理,问题,包含,公司,模块
问普通合伙企业设立条件哪些,问题,包含,公司,模块
问股份有限公司股东人数有没有限制,问题,包含,公司,模块
问法人可以不经股东同意抵押公司吗,问题,包含,公司,模块
问企业设立的条件是什么,问题,包含,公司,模块
问在我国公司法人去世公司债务如何处理,问题,包含,公司,模块
问公司法董事资格方面有什么限制,问题,包含,公司,模块
问发行可转换公司债券的主体资格都有哪些呢,问题,包含,公司,模块
问公司法人的权利有哪些,问题,包含,公司,模块
问企业重组有哪些基本方式,问题,包含,公司,模块
问公司犯罪由谁承担责任,问题,包含,公司,模块
问公司法人代表的任职资格是什么,问题,包含,公司,模块
问公司注销后欠款怎么办,问题,包含,公司,模块
问谁可以代表公司对外签订协议,问题,包含,公司,模块
问公司设立流程是怎样的,问题,包含,公司,模块
问法定代表人退出的条件,问题,包含,公司,模块
问申请股东知情权的诉讼需要什么证据,问题,包含,公司,模块
问公司犯罪股东有责任吗,问题,包含,公司,模块
问集团公司成立条件是什么,问题,包含,公司,模块
问持股多少进入股东大会,问题,包含,公司,模块
问可以一直担任董事吗,问题,包含,公司,模块
问公司章程变更流程是怎样的,问题,包含,公司,模块
问股东变更要换营业执照吗,问题,包含,公司,模块
问公司法对股东出资有哪些规定,问题,包含,公司,模块
问公司设立需要什么资料,问题,包含,公司,模块
问办理营业执照程序有哪些,问题,包含,公司,模块
问上市公司融资需要什么条件,问题,包含,公司,模块
问被骗去做法定代表人怎么办,问题,包含,公司,模块
问股东退股有分盈利的权利吗,问题,包含,公司,模块
问不想开公司了如何解散公司,问题,包含,公司,模块
问公司倒闭股东要赔钱吗？,问题,包含,公司,模块
问股份有限公司设立人数是多少,问题,包含,公司,模块
问非股东能否当法定代表人,问题,包含,公司,模块
问法人变更流程是怎样的,问题,包含,公司,模块
问公司收购本公司股份的法定情形有哪些,问题,包含,公司,模块
问股份公司股东变更是否要到工商备案,问题,包含,公司,模块
问董事会成立条件有哪些,问题,包含,公司,模块
问企业并购的程序是什么,问题,包含,公司,模块
问受让股权股东对瑕疵出资的法律责任,问题,包含,公司,模块
问分公司法人是否必须要成立,问题,包含,公司,模块
问股权转让如何交割,问题,包含,公司,模块
问公司分立的法律效果有哪些,问题,包含,公司,模块
问根据法律的规定办营业执照需要什么资料,问题,包含,公司,模块
问有限合伙企业设立必须有章程吗,问题,包含,公司,模块
问印制发票的企业应当具备哪些条件,问题,包含,公司,模块
问企业注销后还能营业吗,问题,包含,公司,模块
问旗下分公司可以签合同吗,问题,包含,公司,模块
问召开董事会的程序是什么,问题,包含,公司,模块
问新公司法董事长能兼总经理吗,问题,包含,公司,模块
问公司法院起诉需要哪些步骤,问题,包含,公司,模块
问股东有什么权利,问题,包含,公司,模块
问公司法人股东变更费用的相关规定,问题,包含,公司,模块
问股权转让债权债务公示期限是什么,问题,包含,公司,模块
问股权转让的法律依据是怎样的,问题,包含,公司,模块
问居间合同交房时间约定不一致应该怎么办,问题,包含,公司,模块
问公司破产法定代表人承担责任吗,问题,包含,公司,模块
问股东资格的认定标准是什么,问题,包含,公司,模块
问一人有限责任公司增资程序是什么,问题,包含,公司,模块
问公司分立的程序,问题,包含,公司,模块
问公司法人资格取得的条件是什么？,问题,包含,公司,模块
问股东未出资对公司要承担什么责任,问题,包含,公司,模块
问代持股东如何退出,问题,包含,公司,模块
问股东知情权诉讼判决如何执行,问题,包含,公司,模块
问有限责任公司注册资本最低限额是多少,问题,包含,公司,模块
问企业商标注册需要多久,问题,包含,公司,模块
问董事会的职责与形成是怎样的,问题,包含,公司,模块
问公司注销了还能仲裁吗,问题,包含,公司,模块
问继承股东的权利有哪些,问题,包含,公司,模块
问公司法112条全体董事的规定是怎么样的,问题,包含,公司,模块
问股权代持协议的风险有哪些,问题,包含,公司,模块
问企业经济裁员需要经过哪些程序,问题,包含,公司,模块
问不出资占股份是合法的吗,问题,包含,公司,模块
问技术入股需要承担负债吗,问题,包含,公司,模块
问公司法董事长产生是怎么规定,问题,包含,公司,模块
问公司法表决权的内容有哪些,问题,包含,公司,模块
问股权转让需不需要验资,问题,包含,公司,模块
问内资企业股权转让流程有哪些,问题,包含,公司,模块
问公司法关联交易金额的规定有哪些,问题,包含,公司,模块
问股权转让协议解除条件有哪些,问题,包含,公司,模块
问股权转让个税评估需要吗,问题,包含,公司,模块
问公司增资流程是什么,问题,包含,公司,模块
问股东股权转让流程及所需材料是什么,问题,包含,公司,模块
问股权转让协议主体是什么,问题,包含,公司,模块
问股权转让的工商变更需要哪些材料,问题,包含,公司,模块
问公司法股东转让股权是否需要其他股东同意,问题,包含,公司,模块
问企业股权转让协议是什么样的,问题,包含,公司,模块
问股权转让协议意向书具备法律约束力吗,问题,包含,公司,模块
问股权转让协议书还能修改吗,问题,包含,公司,模块
问关于公司法转让股权转让的规定是什么,问题,包含,公司,模块
问企业股东投资转让股权需要哪些材料,问题,包含,公司,模块
问股权转让是否征税有哪些税,问题,包含,公司,模块
问公司法其他股东半数同意股权是否可以转让,问题,包含,公司,模块
问外资企业股权变更流程是怎么样的,问题,包含,公司,模块
问公司法人转让股权变更手续是怎样的,问题,包含,公司,模块
问公司收购股权转让中的法律风险是什么,问题,包含,公司,模块
问企业宣告破产的情形,问题,包含,公司,模块
问股东如何承担公司经营期间亏损,问题,包含,公司,模块
问股权转让变更登记材料有哪些,问题,包含,公司,模块
问转让部分股权协议是什么,问题,包含,公司,模块
问企业债务怎么承担责任,问题,包含,公司,模块
问破产债权得不到偿还如何处理,问题,包含,公司,模块
问公司被债权人告法院该怎么办,问题,包含,公司,模块
问公司破产债务如何清偿,问题,包含,公司,模块
问公司破产怎么清算债权,问题,包含,公司,模块
问宣告破产程序期限是多少天,问题,包含,公司,模块
问破产债权申报法定期限是多久,问题,包含,公司,模块
问怎么处理股权转让纠纷,问题,包含,公司,模块
问股权转让无效的情况是什么?,问题,包含,公司,模块
问赠与公司股权可以附哪些条件?,问题,包含,公司,模块
问如何处理股权转让合同纠纷?,问题,包含,公司,模块
问公司股权变更需要登记吗?,问题,包含,公司,模块
问股权转让可以代理吗,问题,包含,公司,模块
问申请公司需要什么手续,问题,包含,公司,模块
问公司清算后债务如何处理,问题,包含,公司,模块
问公司破产倒闭员工可以得到哪些补偿,问题,包含,公司,模块
问公司的合并程序,问题,包含,公司,模块
问破产财产分配顺序,问题,包含,公司,模块
问收购公司流程是什么,问题,包含,公司,模块
问公司法股东会决议效力,问题,包含,公司,模块
问股东未实际出资可以转让股权吗,问题,包含,公司,模块
问公司清算一般流程包括哪些,问题,包含,公司,模块
问有限责任公司股东不同意股权转让要怎么办,问题,包含,公司,模块
问破产宣告的效力,问题,包含,公司,模块
问清算的中止与终止是什么意思,问题,包含,公司,模块
问涉外股权转让合同纠纷管辖规定有哪些,问题,包含,公司,模块
问有限责任公司清算程序是如何规定的,问题,包含,公司,模块
问合伙企业解散后如何清算,问题,包含,公司,模块
问股份公司的重整的程序是什么,问题,包含,公司,模块
问债权人起诉清算组成员要求赔偿损失可以吗,问题,包含,公司,模块
问合伙人是否承担债务连带责任,问题,包含,公司,模块
问股东实际出资未载入股东名册享有股权吗,问题,包含,公司,模块
问公司股权转让是否债务也转让,问题,包含,公司,模块
问无处分权未追认转让的股权是否有效,问题,包含,公司,模块
问股份有限公司发起设立有哪些程序,问题,包含,公司,模块
问股份有限公司的股份转让的条件有哪些,问题,包含,公司,模块
问公司破产倒闭后如何赔偿员工,问题,包含,公司,模块
问分割财产时涉及合伙企业出资怎么处理,问题,包含,公司,模块
问企业成立时出资就是公司的股东吗,问题,包含,公司,模块
问股份有限公司法定代表人怎么确定,问题,包含,公司,模块
问现在注册公司的资金有哪些条件,问题,包含,公司,模块
问公司违法股东有责任吗,问题,包含,公司,模块
问有限公司自行清算的具体程序都有哪些,问题,包含,公司,模块
问个人独资企业转让的程序,问题,包含,公司,模块
问股东股权转让包括哪些权利的转让,问题,包含,公司,模块
问注册一人有限责任公司要带什么材料,问题,包含,公司,模块
问合伙企业营业执照到期法律后果主要有哪些,问题,包含,公司,模块
问如果公司倒闭怎么赔偿员工,问题,包含,公司,模块
问有限合伙人债务怎么承担,问题,包含,公司,模块
问什么样的公司可以申请破产,问题,包含,公司,模块
问公司有经济纠纷股东有什么责任,问题,包含,公司,模块
问公司倒闭债权怎么办,问题,包含,公司,模块
问外企公司突然倒闭跑了员工赔偿怎么办,问题,包含,公司,模块
问一人独资有限责任公司注销后能起诉吗,问题,包含,公司,模块
问公司民事诉讼中可以申请破产吗,问题,包含,公司,模块
问破产程序其他债权人的权利是什么,问题,包含,公司,模块
问如何成立公司,问题,包含,公司,模块
问公司法中表决权的行使方式有哪些,问题,包含,公司,模块
问公司倒闭如何赔偿产假员工,问题,包含,公司,模块
问公司转让股权职工怎么办理流程,问题,包含,公司,模块
问公司清算必备法律程序有什么,问题,包含,公司,模块
问有限合伙企业设立的条件,问题,包含,公司,模块
问三期员工公司倒闭怎么获得赔偿,问题,包含,公司,模块
问公司倒闭遣散员工如何赔偿,问题,包含,公司,模块
问公司注销要满足什么条件,问题,包含,公司,模块
问公司倒闭破产员工怎么赔偿,问题,包含,公司,模块
问破产清算期限,问题,包含,公司,模块
问私人公司解散有工资补偿吗,问题,包含,公司,模块
问上市公司条件需要哪些,问题,包含,公司,模块
问有限公司营业执照有效期多少年,问题,包含,公司,模块
问总公司应对分公司债务直接清偿,问题,包含,公司,模块
问个体户营业执照去哪里年检,问题,包含,公司,模块
问什么情况下可以申请企业破产？,问题,包含,公司,模块
问有限责任公司设立的条件是什么,问题,包含,公司,模块
问公司章程自己能修改吗,问题,包含,公司,模块
问设立股份公司应当具备哪些条件,问题,包含,公司,模块
问债权人委员会有哪些职权,问题,包含,公司,模块
问法人股转让规定,问题,包含,公司,模块
问企业法人的终止条件是什么,问题,包含,公司,模块
问公司股权转让怎么进行,问题,包含,公司,模块
问子公司注册流程具体有哪些,问题,包含,公司,模块
问营业执照变更的程序有哪些,问题,包含,公司,模块
问股权转让纠纷怎么确定管辖,问题,包含,公司,模块
问怎样注册新公司,问题,包含,公司,模块
问合伙时贷款退伙后还要偿还吗,问题,包含,公司,模块
问国有公司倒闭员工怎么赔偿,问题,包含,公司,模块
问公司法人是否需要持股,问题,包含,公司,模块
问公司并购的形式主要有哪些,问题,包含,公司,模块
问进行虚假的纳税申报属于偷税行为吗,问题,包含,公司,模块
问没进行工商登记的股权转让有效吗,问题,包含,公司,模块
问公司破产债权如何确定,问题,包含,公司,模块
问公司倒闭了没钱怎么赔偿员工,问题,包含,公司,模块
问破产重整和破产清算的区别,问题,包含,公司,模块
问公司起名核准的时间是多久,问题,包含,公司,模块
问股权如何分红,问题,包含,公司,模块
问注册公司需要什么手续,问题,包含,公司,模块
问公司股东股权转让可以撤销吗？,问题,包含,公司,模块
问公司股份回购程序,问题,包含,公司,模块
问有限合伙企业设立条件,问题,包含,公司,模块
问老板公司倒闭怎么赔偿员工,问题,包含,公司,模块
问注册公司需要几个人,问题,包含,公司,模块
问企业破产后债务怎么办,问题,包含,公司,模块
问有限公司的股权质押有哪些限制,问题,包含,公司,模块
问新公司成立条件有哪些,问题,包含,公司,模块
问公司法对公司发起人的要求,问题,包含,公司,模块
问公司申请破产的程序是什么,问题,包含,公司,模块
问公司解散情形主要有哪些,问题,包含,公司,模块
问私下签订股权转让协议有效吗,问题,包含,公司,模块
问公司注销清算报告内容,问题,包含,公司,模块
问股东可以申请解散公司吗,问题,包含,公司,模块
问个人破产后债务怎么办,问题,包含,公司,模块
问公司营业执照怎么变更经营范围,问题,包含,公司,模块
问公司倒闭清算怎么赔偿员工工资,问题,包含,公司,模块
问合伙企业公司设立条件,问题,包含,公司,模块
问营业执照办理流程是怎么样的,问题,包含,公司,模块
问合伙企业财产处分的规定,问题,包含,公司,模块
问设立公司注册资金要求,问题,包含,公司,模块
问企业间拆借资金怎样做才属合法,问题,包含,公司,模块
